Frédérique,Riou,valentine53@example.com,2004-04-26,0761222850,avenue Nicolas Leclerc,24111,Étienne-les-Bains,France,ingénieur en aéronautique expert en marketing digital avec 13 ans d'expérience,Dias,111609,Divorcé(e),0,Master,2020-06-07,2025-04-09 01:55:23,false,Email,"Lecture, Technologie, Jeux vidéo"
Capucine,Delaunay,paul74@example.com,1969-04-28,0793153069,"639, rue de Schmitt",16742,Paul-la-Forêt,France,animateur socioculturel socioculturelle analyste en cloud computing avec 9 ans d'expérience,Jacques S.A.,98510,Célibataire,0,Autre,2020-04-29,2024-06-22 23:11:46,false,SMS,Cuisine
Astrid,Chevalier,thomas62@example.com,1958-02-28,0729170354,"22, avenue Valentine Lamy",09986,Lopez,France,chef de publicité expert en analyse de données avec 13 ans d'expérience,Chauvin,42785,Célibataire,2,Baccalauréat,2023-02-28,2025-01-14 05:43:17,false,SMS,"Lecture, Art, Jeux vidéo"
Thomas,Gaillard,maryse45@example.org,2001-01-13,0780130261,"26, rue de Andre",97276,Turpin,France,ingénieur système ingénieur en intelligence artificielle avec 16 ans d'expérience,De Sousa Lenoir S.A.,98182,Veuf(ve),4,Baccalauréat,2020-06-12,2024-09-08 07:14:49,false,Courrier,"Voyage, Lecture, Cuisine, Jeux vidéo"
Anouk,Germain,edouard13@example.org,1992-08-01,0659456692,"57, avenue Benjamin Pinto",97137,Sainte Xavierboeuf,France,directeur des services pénitentiaires responsable en analyse de données avec 12 ans d'expérience,Dupuis,93123,Célibataire,2,BTS/DUT,2021-02-01,2024-06-25 10:56:47,true,Téléphone,Cuisine
Marianne,Bourgeois,huetbenoit@example.net,1950-04-15,07827293,"11, chemin Fernandes",71411,Delorme,France,consultant en management de l'innovation technicien en finance internationale avec 16 ans d'expérience,Perrier,28857,Veuf(ve),4,Master,2021-07-07,2025-01-16 16:59:17,false,Courrier,"Technologie, Voyage"
Anastasie,Daniel,gillespatricia@example.org,1961-09-16,0610807395,boulevard Breton,75147,Boulay,France,animateur du patrimoine conseiller en gestion de projet avec 13 ans d'expérience,Blanchard,59340,Marié(e),2,Master,2022-08-09,2024-07-02 19:02:35,true,SMS,"Sport, Cuisine"
Arnaude,Bazin,cleveque@example.org,1964-09-01,0772380699,"9, chemin Christine Da Costa",32858,Morvan-sur-Fernandes,France,commissaire de police consultant en communication avec 16 ans d'expérience,Grondin Paul SA,62758,Marié(e),4,BTS/DUT,2020-07-20,2024-10-15 01:07:37,false,SMS,"Jeux vidéo, Sport, Mode, Art"
Auguste,Blondel,victoirefoucher@example.net,1993-09-14,0797978674,boulevard de Dupuy,34848,Guibert,France,développeur économique spécialisé en marketing digital avec 17 ans d'expérience,De Oliveira Sanchez SARL,95678,Pacsé(e),3,Doctorat,2023-04-07,2024-05-06 21:06:03,true,Email,Lecture
Valérie,Lebreton,colletrene@example.net,1981-07-23,0632424289,"99, boulevard Pierre Navarro",90641,Perret,France,ingénieur analyste de l'air spécialisé en marketing digital avec 14 ans d'expérience,Bertin,115495,Divorcé(e),3,Master,2022-10-28,2024-11-20 09:56:01,true,Email,"Lecture, Cinéma, Technologie, Musique"
Colette,Meunier,xavier51@example.com,1981-06-04,0792420275,rue Delattre,35949,Sainte Catherine,France,chef de projet démantèlement nucléaire technicien en communication avec 8 ans d'expérience,Coulon,98154,Veuf(ve),0,Master,2024-08-11,2024-09-30 11:06:58,true,Téléphone,Cuisine
Thérèse,Fischer,da-costaodette@example.com,1979-06-02,0619669797,"21, boulevard Manon Lemonnier",95897,Perez,France,rédacteur territorial territoriale consultant en logistique avec 13 ans d'expérience,Guillet,47087,Pacsé(e),3,Baccalauréat,2022-11-26,2024-10-23 13:21:56,true,Email,"Art, Voyage, Technologie"
Sylvie,Caron,thibaultroger@example.com,1969-01-29,0749985894,"396, avenue Robin",40640,Moreaunec,France,peintre en bâtiment conseiller en logistique avec 18 ans d'expérience,Pascal,117776,Veuf(ve),0,Doctorat,2021-04-13,2024-09-30 11:23:29,true,Courrier,"Sport, Cuisine"
Zoé,Marchand,legrandvincent@example.org,1957-04-17,0763924955,chemin Bouvet,13900,JacquotVille,France,ingénieur recherche et développement en agroalimentaire analyste en communication avec 11 ans d'expérience,Mallet,91390,Pacsé(e),2,Master,2020-10-18,2024-05-16 16:27:13,true,Email,"Mode, Sport, Voyage, Cinéma"
Sabine,Dijoux,camille35@example.com,1957-09-27,0660333747,"41, rue Maryse Joubert",81961,Lopez-sur-Hoareau,France,podo-orthésiste spécialisé en intelligence artificielle avec 4 ans d'expérience,Andre,65790,Veuf(ve),2,Autre,2024-05-23,2024-06-30 03:21:47,false,Téléphone,"Musique, Sport, Voyage, Mode"
Marthe,Leclercq,lefortlaurent@example.net,1962-11-05,0760896440,"52, chemin Théophile Rossi",65270,Lombard-les-Bains,France,musicien analyste en ressources humaines avec 12 ans d'expérience,Gillet Toussaint SARL,115212,Veuf(ve),2,Licence,2022-01-07,2025-03-24 15:55:30,true,Téléphone,"Jeux vidéo, Cinéma, Mode"
Michel,Laroche,rodriguespenelope@example.com,1976-11-18,0618154063,"77, boulevard Théophile Noël",66966,Saint Émilie,France,chargé de production responsable en développement web avec 2 ans d'expérience,Lebrun,109046,Divorcé(e),3,Doctorat,2022-06-17,2024-09-07 07:13:08,true,Téléphone,"Cinéma, Technologie"
Louis,Clerc,daniel35@example.com,1993-04-12,0799979398,"4, avenue Manon Auger",83295,Lévêque,France,animateur 2D et 3D ingénieur en communication avec 12 ans d'expérience,Laurent SA,118076,Divorcé(e),3,Licence,2021-02-18,2024-10-31 10:18:23,true,SMS,"Art, Musique, Sport"
Laetitia,Fernandes,henrifaivre@example.com,1951-01-27,0738782393,"62, rue de Becker",01494,LagardeVille,France,designer d'interaction consultant en développement web avec 6 ans d'expérience,Lopes S.A.S.,48553,Marié(e),4,Licence,2023-03-09,2024-06-16 06:01:09,true,SMS,"Musique, Cuisine, Technologie"
Laurence,Texier,roger90@example.com,1953-12-31,0770303543,"69, boulevard Weiss",32336,Saint Matthieu,France,ingénieur technico-commercial technico-commerciale en informatique ingénieur en développement web avec 8 ans d'expérience,Blanc,73578,Célibataire,3,BTS/DUT,2023-09-27,2024-08-28 15:18:45,false,SMS,"Technologie, Sport, Cuisine"
Marianne,Simon,noemihoareau@example.org,1977-07-03,0684534058,"53, rue de Deschamps",44487,Lambert,France,animateur de radio et de télévision responsable en gestion de projet avec 5 ans d'expérience,Garcia,70189,Divorcé(e),2,Doctorat,2021-10-19,2025-02-03 21:29:57,false,SMS,"Voyage, Cinéma, Musique"
Martin,Petitjean,bertrandmarion@example.com,1989-05-20,0655752534,"70, rue Chevallier",48234,Saint Margot-les-Bains,France,chirurgien-dentiste technicien en gestion de projet avec 5 ans d'expérience,Poirier SA,25540,Marié(e),2,Baccalauréat,2024-09-04,2025-02-05 01:53:22,true,Courrier,"Art, Voyage, Cinéma"
Michelle,Coste,gomescharles@example.com,2005-05-22,0685214158,chemin de Cohen,32191,Thomas-sur-Martineau,France,garçon de café responsable en communication avec 16 ans d'expérience,Clément,56682,Marié(e),4,BTS/DUT,2022-12-16,2024-10-15 13:47:46,true,Email,"Sport, Lecture"
Inès,Bourgeois,salmonbenoit@example.org,1958-08-12,0737161884,"65, boulevard Audrey Pierre",17525,Dupuis,France,animateur de bassin versant conseiller en cloud computing avec 14 ans d'expérience,Dubois SARL,82517,Veuf(ve),2,BTS/DUT,2023-08-04,2025-03-05 21:57:51,true,Courrier,"Jeux vidéo, Lecture, Cuisine"
Rémy,Bailly,marcelleda-silva@example.com,1990-03-09,0622349177,"29, avenue de Morel",21731,Hernandez-les-Bains,France,technicien d'exploitation de l'eau analyste en logistique avec 13 ans d'expérience,Weber S.A.R.L.,61384,Pacsé(e),1,Master,2022-08-25,2025-04-03 03:27:58,false,Courrier,"Cuisine, Technologie, Cinéma, Art"
Isaac,Menard,madeleineguillon@example.org,1991-01-01,0676114703,"80, boulevard Monique Maurice",54859,MilletVille,France,chef de chantier expert en gestion de projet avec 2 ans d'expérience,Carlier,33465,Divorcé(e),2,Licence,2023-06-07,2024-08-19 08:32:47,true,SMS,"Art, Mode, Jeux vidéo"
Adrien,Lesage,manon28@example.net,2000-10-29,0749365399,rue de Gros,42781,ArnaudBourg,France,roboticien analyste en finance internationale avec 5 ans d'expérience,Tanguy,73109,Célibataire,4,Baccalauréat,2021-12-02,2024-05-03 19:28:11,true,Téléphone,Lecture
Arnaude,Besson,isabellemorvan@example.net,1982-01-08,0637460272,"84, rue Hortense Alexandre",30900,BlanchardVille,France,commissaire de police ingénieur en marketing digital avec 13 ans d'expérience,Lacroix SA,75111,Pacsé(e),4,Master,2021-03-14,2024-12-05 01:02:50,false,SMS,Mode
Françoise,Vallée,cpasquier@example.net,1955-03-17,0742222954,"12, rue Lacombe",17416,Monnier,France,ingénieur en métrologie spécialisé en développement web avec 13 ans d'expérience,Prévost,112525,Célibataire,1,BTS/DUT,2020-10-08,2024-07-08 19:32:58,true,Courrier,"Cinéma, Lecture"
Jules,Martinez,blaurent@example.net,1967-08-22,0640014642,"1, rue Robert Valette",84929,Sainte Laurencedan,France,soudeur responsable en développement web avec 16 ans d'expérience,Briand,26143,Célibataire,3,Master,2023-04-21,2024-12-01 11:46:44,true,Email,Cuisine
Jacques,Guichard,gerard86@example.net,1952-06-10,0730113916,"62, chemin Thibault Thibault",50233,Charles,France,aide-chimiste ingénieur en communication avec 14 ans d'expérience,Pages,75576,Célibataire,3,Licence,2023-11-05,2024-05-28 01:12:01,false,SMS,"Cinéma, Sport, Lecture"
Robert,Salmon,torresalexandria@example.com,1972-05-03,0614806759,"42, avenue Traore",75194,ChauvetBourg,France,conducteur de machine onduleuse analyste en logistique avec 4 ans d'expérience,Bailly Monnier SARL,25290,Veuf(ve),0,Baccalauréat,2023-10-29,2024-07-03 11:54:57,true,Email,"Lecture, Sport, Voyage"
Xavier,Alexandre,andree86@example.net,1998-05-02,0695025926,"4, chemin de Guyot",35295,Thibault,France,technicien d'analyses biomédicales technicien en qualité avec 5 ans d'expérience,Bègue,88722,Célibataire,1,Licence,2020-08-17,2024-07-22 22:29:58,false,SMS,Jeux vidéo
Anaïs,Gros,wfernandes@example.org,2000-09-05,0729558938,"32, rue Alexandria Guyon",86451,Godard,France,conducteur de bus ou d'autocar spécialisé en marketing digital avec 8 ans d'expérience,Dupont,119002,Célibataire,3,Master,2022-08-15,2025-03-10 01:55:21,false,Email,"Mode, Technologie"
Diane,Barre,mrobert@example.com,1960-10-12,0668264386,avenue Jeanne Richard,33832,HuetBourg,France,responsable de formation conseiller en gestion de projet avec 15 ans d'expérience,Briand,66381,Célibataire,3,Autre,2021-11-07,2025-01-05 02:01:28,true,Email,"Cuisine, Lecture, Voyage, Cinéma"
Lucas,Blot,david16@example.net,1990-04-20,0752737221,"15, chemin Nath Delannoy",18495,Royer-sur-Benoit,France,ingénieur du BTP expert en marketing digital avec 6 ans d'expérience,Carpentier,81827,Marié(e),2,Autre,2023-10-07,2024-07-10 04:37:28,true,Téléphone,"Mode, Musique, Art, Voyage"
Théodore,Louis,chantal75@example.com,1966-04-29,0616459342,"1, rue Alves",97367,Weber,France,ingénieur en construction automobile spécialisé en finance internationale avec 3 ans d'expérience,Marty SA,110760,Divorcé(e),3,Baccalauréat,2023-01-06,2025-03-10 03:07:02,false,Téléphone,"Voyage, Jeux vidéo, Art"
Antoinette,Alexandre,gautierroger@example.net,1981-06-25,0729009493,"41, avenue Alexandrie Bonnin",18484,LeconteBourg,France,cadreur responsable en marketing digital avec 2 ans d'expérience,Reynaud,28293,Divorcé(e),4,BTS/DUT,2020-10-19,2024-07-07 07:16:32,false,SMS,"Musique, Mode"
Richard,Lopez,danieldelahaye@example.org,1954-01-28,0639340619,"830, boulevard Gomez",87215,Leroux-la-Forêt,France,ingénieur forage ingénieur en sécurité informatique avec 13 ans d'expérience,Lejeune et Fils,45173,Pacsé(e),0,Doctorat,2024-08-23,2024-05-17 14:37:32,true,Téléphone,"Jeux vidéo, Musique, Voyage"
Nicole,Leleu,dorotheemerle@example.net,1963-11-11,0749874886,"66, chemin Guibert",92343,Bourdon-sur-Fleury,France,sportif de haut niveau conseiller en finance internationale avec 20 ans d'expérience,Allain,104625,Veuf(ve),2,Autre,2024-04-04,2024-08-19 09:11:16,true,SMS,"Musique, Mode, Sport"
Thibault,Auger,virginie34@example.net,1978-09-21,0631021817,"789, rue Marchal",67797,Menard,France,gestionnaire de données cliniques technicien en finance internationale avec 18 ans d'expérience,Faure Benard S.A.,93725,Célibataire,1,Baccalauréat,2023-06-06,2025-01-09 15:18:23,false,Téléphone,Voyage
Gilles,Antoine,clairecousin@example.net,1964-02-07,0697871326,"66, boulevard Leleu",32618,Sainte Nathalie-sur-Mer,France,metteur en scène technicien en qualité avec 12 ans d'expérience,David et Fils,99617,Célibataire,4,BTS/DUT,2025-01-22,2024-09-18 17:12:24,true,Courrier,"Lecture, Jeux vidéo"
Daniel,Vidal,legendrececile@example.org,1982-05-04,0753088707,"66, rue Morin",31943,Munozboeuf,France,gestionnaire de données cliniques responsable en gestion de projet avec 15 ans d'expérience,Vasseur,71037,Pacsé(e),1,Doctorat,2025-03-11,2025-01-30 11:30:16,true,SMS,"Technologie, Musique, Voyage, Art"
Christelle,Pichon,erodriguez@example.org,1997-11-13,0673096481,rue Dupuy,84926,Mathieudan,France,acheteur conseiller en gestion de projet avec 19 ans d'expérience,Gay,86098,Pacsé(e),2,Master,2022-10-17,2024-05-22 15:48:01,false,SMS,"Mode, Art"
Caroline,Ruiz,agathe89@example.org,2001-03-01,0780814274,"57, rue Marthe Diaz",97316,Mercier-les-Bains,France,médiateur scientifique conseiller en ressources humaines avec 8 ans d'expérience,Pages,36555,Pacsé(e),0,BTS/DUT,2020-06-25,2025-03-04 10:48:12,false,SMS,Mode
Dorothée,Georges,lboulanger@example.org,2000-12-29,0638373681,"80, rue de Breton",65172,Masson-sur-Paul,France,biologiste médical ingénieur en développement web avec 14 ans d'expérience,Valette SA,90880,Veuf(ve),1,Doctorat,2021-07-25,2025-03-08 18:08:20,true,Email,Technologie
Thérèse,Blondel,zoepeltier@example.com,1980-03-20,0720734590,"60, avenue Matthieu Faivre",59377,Marchand,France,technicien radioprotection technicien en finance internationale avec 14 ans d'expérience,Aubert SARL,71409,Veuf(ve),2,Autre,2021-06-08,2024-11-23 08:32:55,true,Email,"Sport, Art, Musique"
Anouk,Lucas,dramos@example.org,1961-10-21,0699741895,"33, boulevard Nicolas Moulin",54790,Pinto,France,responsable de laboratoire de contrôle en chimie consultant en développement web avec 5 ans d'expérience,Roger,83008,Marié(e),3,Doctorat,2020-11-12,2024-08-13 02:13:19,false,SMS,"Art, Lecture, Cinéma, Cuisine"
Chantal,Cordier,uclement@example.org,1951-04-05,0781584250,"969, avenue de Didier",57771,François,France,consultant informatique expert en gestion de projet avec 5 ans d'expérience,Jacques,49991,Veuf(ve),1,Master,2024-11-18,2025-04-06 13:41:08,false,SMS,"Technologie, Art"
Jules,Barre,zachariehamon@example.org,1998-01-27,0688125556,"126, rue de Sanchez",92541,Charrier,France,rédacteur on line responsable en qualité avec 15 ans d'expérience,Petit,26809,Divorcé(e),1,Doctorat,2021-12-12,2024-05-06 20:48:48,false,Courrier,"Cuisine, Sport, Technologie"
Suzanne,Bourdon,anne85@example.org,1999-08-29,0781863594,"30, boulevard de Adam",42985,Jacob-sur-Techer,France,gardien de la paix spécialisé en ressources humaines avec 14 ans d'expérience,Ribeiro,90134,Célibataire,0,Autre,2022-10-23,2024-09-06 08:18:37,true,Courrier,"Technologie, Sport"
Henriette,Valentin,edouardpetit@example.net,1957-11-19,0656169200,"45, avenue de Marty",32101,Valette,France,salesman ingénieur en logistique avec 7 ans d'expérience,Sauvage,33945,Divorcé(e),1,Master,2020-10-02,2024-07-03 13:53:48,true,Téléphone,"Voyage, Lecture"
Jeanne,Delorme,virginielevy@example.org,1953-09-08,0793730334,"66, rue de Dupré",71666,Sainte Victoire,France,peintre en bâtiment technicien en logistique avec 20 ans d'expérience,Godard S.A.S.,35244,Divorcé(e),2,BTS/DUT,2023-12-13,2024-12-25 00:37:00,false,Courrier,"Lecture, Mode"
Étienne,Launay,benoittorres@example.net,1997-05-20,0782701666,"42, rue de Gaudin",66435,Delaunay,France,ingénieur systèmes embarqués ingénieur en développement web avec 14 ans d'expérience,Morin Wagner et Fils,31060,Marié(e),0,BTS/DUT,2022-02-27,2025-02-07 19:39:43,false,Courrier,"Lecture, Technologie"
Margot,Bernier,vweber@example.org,1962-07-05,0763378004,"48, rue Marine Foucher",49419,Maillet,France,chercheur en chimie ingénieur en cloud computing avec 4 ans d'expérience,Weber Bousquet S.A.,35787,Divorcé(e),1,Baccalauréat,2023-02-18,2025-04-24 17:35:41,true,SMS,"Technologie, Cinéma"
Gilles,Barbier,lucas72@example.com,1981-04-30,0724077603,"70, rue Gillet",94515,Sainte René,France,technicien plasturgiste consultant en qualité avec 16 ans d'expérience,Andre Louis S.A.R.L.,80431,Pacsé(e),4,Baccalauréat,2021-05-19,2025-04-20 14:33:42,false,Téléphone,"Cuisine, Cinéma, Lecture, Voyage"
Margaud,Laporte,oceanethibault@example.org,1952-01-23,074667769,"7, avenue Monnier",22193,Saint LucBourg,France,ingénieur métallurgiste consultant en ressources humaines avec 10 ans d'expérience,Hebert S.A.,54942,Divorcé(e),4,Doctorat,2023-12-07,2024-06-08 23:15:20,false,Courrier,"Voyage, Art"
Jérôme,Breton,jeromepottier@example.org,1990-04-26,0656914034,"837, rue Costa",02380,Aubry,France,technicien électronicien électronicienne responsable en ressources humaines avec 10 ans d'expérience,Guérin Schmitt S.A.,53799,Célibataire,3,Licence,2024-03-17,2025-02-19 10:00:24,false,Email,"Mode, Cinéma, Musique, Jeux vidéo"
Patrick,Roux,mauger@example.com,1950-01-23,0721155899,"2, avenue Besnard",92338,Sainte Émile,France,dessinateur-projeteur responsable en logistique avec 15 ans d'expérience,Gonzalez,84323,Marié(e),2,Master,2021-11-13,2025-04-26 18:24:50,false,Téléphone,"Jeux vidéo, Art"
Antoine,Delorme,xhoareau@example.com,1959-10-05,0631558215,"9, boulevard Da Silva",32583,Cordier,France,clerc d'huissier ingénieur en cloud computing avec 9 ans d'expérience,Lebrun,109263,Marié(e),2,BTS/DUT,2024-10-31,2024-07-07 18:16:29,false,Courrier,"Voyage, Art, Mode, Musique"
Marianne,Martin,noemi44@example.com,1983-02-13,0620414787,"71, chemin Lemaître",17528,Goncalvesnec,France,scénariste consultant en finance internationale avec 13 ans d'expérience,Gay Laporte SARL,40155,Veuf(ve),2,BTS/DUT,2023-02-02,2024-12-18 22:18:37,true,Téléphone,"Mode, Sport"
Thibaut,Gaillard,marcelmartineau@example.org,1975-11-30,0740681492,"479, boulevard de Albert",90485,Lemonnier,France,géomètre-topographe expert en développement web avec 5 ans d'expérience,Boulanger S.A.S.,43011,Pacsé(e),4,Master,2024-01-16,2024-08-02 10:12:07,false,Email,Musique
David,Petitjean,francois52@example.net,2005-05-16,0754744514,rue Alain Gonzalez,35383,Ledoux-les-Bains,France,accessoiriste conseiller en qualité avec 5 ans d'expérience,Lemaître S.A.,55049,Célibataire,2,Licence,2020-07-21,2024-05-11 05:24:06,true,Email,Voyage
Martin,Lemaire,pimbert@example.net,1965-02-23,0644706607,"992, boulevard Cécile Joly",48468,Renard-sur-Mer,France,formateur en informatique spécialisé en intelligence artificielle avec 17 ans d'expérience,Guillou SARL,77379,Veuf(ve),0,Master,2021-10-24,2025-04-09 23:04:34,false,Email,"Technologie, Lecture, Mode, Art"
Christophe,Guillon,qtoussaint@example.org,1970-12-30,0763866137,"9, avenue Émile Albert",77381,Pottier,France,chef de fabrication des industries graphiques expert en logistique avec 18 ans d'expérience,Thibault,107890,Pacsé(e),4,Licence,2020-08-08,2025-01-11 05:42:18,true,Téléphone,Lecture
Aimé,Lacombe,lucedelaunay@example.net,1996-03-14,0782451091,"516, boulevard Paris",54527,Robin,France,chercheur en biologie du sport conseiller en marketing digital avec 15 ans d'expérience,Hernandez,47886,Veuf(ve),2,Baccalauréat,2023-12-21,2025-02-23 11:03:43,false,Email,"Art, Cuisine, Sport"
Noël,Guérin,christelle85@example.com,1963-03-08,0719899571,"46, rue Philippine Paris",02504,Bouchet,France,mixeur son responsable en développement web avec 18 ans d'expérience,Rossi,26791,Célibataire,2,Master,2022-09-11,2024-11-15 07:56:15,false,SMS,"Cuisine, Cinéma"
Alix,Laine,ssauvage@example.net,1970-03-27,0789198836,"53, boulevard de Guérin",28313,LégerVille,France,chargé de valorisation de la recherche expert en sécurité informatique avec 18 ans d'expérience,Ruiz,89694,Célibataire,1,Master,2020-07-18,2024-09-08 02:31:20,false,Téléphone,"Art, Mode"
Alexandre,Philippe,buissoncecile@example.org,1964-02-11,0753991010,boulevard de Diaz,97184,Dias,France,responsable de réseau eau potable consultant en cloud computing avec 16 ans d'expérience,Duval,39171,Célibataire,4,Licence,2023-08-28,2024-12-01 03:42:38,false,Téléphone,"Mode, Musique, Art, Voyage"
Christophe,Martin,ibonneau@example.org,1998-02-10,0688945247,"425, rue Maggie Charles",57140,Verdier,France,conseiller en économie sociale et familiale technicien en qualité avec 16 ans d'expérience,Brun SARL,84986,Veuf(ve),3,BTS/DUT,2022-03-02,2024-07-24 00:43:45,false,SMS,"Jeux vidéo, Sport, Art"
Margot,Foucher,genevievedelattre@example.org,1953-03-26,0621041879,"89, rue Robert Lévy",59113,Saint Jeannine,France,technicien d'analyses biomédicales technicien en finance internationale avec 5 ans d'expérience,Pires,103464,Veuf(ve),4,Baccalauréat,2022-01-01,2024-11-25 12:45:48,true,Téléphone,"Cinéma, Lecture, Mode, Sport"
Léon,Garnier,vincent65@example.org,1959-12-19,0775614073,chemin Marc Navarro,31191,Saint Raymond,France,pilote d'hélicoptère conseiller en finance internationale avec 2 ans d'expérience,Blot,28605,Divorcé(e),2,Baccalauréat,2024-12-04,2024-10-25 07:49:42,true,Téléphone,"Art, Technologie, Voyage"
Jeannine,Bousquet,rene12@example.net,1971-11-11,0721969701,"11, avenue Alphonse Rodrigues",12337,Baudry-sur-Fischer,France,géologue ingénieur en qualité avec 13 ans d'expérience,Barbe,83451,Célibataire,4,Licence,2022-03-31,2025-02-07 13:42:53,false,Email,"Mode, Cuisine"
Maryse,Mallet,mailletmarie@example.net,2000-07-09,0679161188,"2, chemin de Mace",05589,Simonnec,France,analyste de crédit technicien en marketing digital avec 12 ans d'expérience,Coste,117393,Marié(e),3,Baccalauréat,2021-07-04,2024-10-24 13:44:24,true,SMS,Art
Léon,Barthelemy,agathe11@example.net,1983-05-07,0632648660,"55, rue de Dijoux",69744,Lefort,France,costumier expert en analyse de données avec 5 ans d'expérience,Bourdon S.A.R.L.,66208,Divorcé(e),1,Licence,2020-09-08,2025-04-21 09:03:54,true,SMS,"Art, Musique, Cinéma"
Marine,Sauvage,mauricegregoire@example.com,1952-11-15,0727305488,avenue de Seguin,28464,Saint AdèleVille,France,trader spécialisé en analyse de données avec 14 ans d'expérience,Hervé Boyer SA,73124,Divorcé(e),1,Doctorat,2023-02-26,2025-04-10 02:38:33,false,Téléphone,"Technologie, Jeux vidéo, Sport"
Suzanne,Goncalves,marchandtherese@example.net,1953-03-27,069420290,"549, chemin Julie Gillet",62892,ThierryBourg,France,conducteur de train conseiller en ressources humaines avec 18 ans d'expérience,Philippe Rocher S.A.,31193,Célibataire,2,BTS/DUT,2022-10-29,2025-04-11 18:13:15,true,Email,"Mode, Cuisine"
Laure,Cousin,mauricechauvin@example.com,1994-04-29,07149829,"781, rue de Vasseur",81993,Garnier,France,ingénieur technico-commercial technico-commerciale en informatique ingénieur en intelligence artificielle avec 15 ans d'expérience,Delannoy Lévêque SARL,118889,Veuf(ve),4,Licence,2021-09-10,2024-09-01 12:33:22,true,Courrier,"Sport, Lecture, Art"
Anastasie,Chauvet,rleclercq@example.org,1957-05-27,0654884538,"22, rue Barbier",97493,Humbert,France,chargé de communication interne technicien en analyse de données avec 17 ans d'expérience,Dumas,84079,Célibataire,2,Licence,2020-06-03,2024-08-29 21:42:49,false,SMS,"Sport, Art"
Jacqueline,Lecoq,davidperret@example.com,1950-06-11,0679381679,"33, avenue de Marchal",83428,Charles,France,vendeur conseil caviste spécialisé en sécurité informatique avec 11 ans d'expérience,Bourgeois Philippe S.A.S.,89944,Marié(e),3,BTS/DUT,2024-10-02,2024-07-26 09:06:03,true,SMS,Cuisine
Julie,Albert,catherine00@example.com,2004-08-26,0648926572,"32, rue Roy",79694,Morel,France,ingénieur traitement de l'image analyste en analyse de données avec 4 ans d'expérience,Adam,102542,Célibataire,4,BTS/DUT,2024-01-21,2024-12-15 05:35:57,false,SMS,"Art, Cinéma"
Alice,Barbe,alfred45@example.org,1958-02-22,0632975869,"72, rue Dumont",05859,Fernandes-la-Forêt,France,canalisateur technicien en qualité avec 16 ans d'expérience,Lévy,40902,Marié(e),2,Baccalauréat,2020-07-18,2024-08-11 19:20:03,false,SMS,"Voyage, Jeux vidéo, Lecture, Technologie"
Véronique,Rocher,bonneaurichard@example.org,1967-12-19,073401411,"55, avenue Da Costa",01820,Bailly,France,ingénieur matériaux ingénieur en marketing digital avec 18 ans d'expérience,Masse,72804,Célibataire,1,Baccalauréat,2023-09-23,2024-09-20 09:41:00,true,Courrier,Sport
Benoît,Chauvin,marine04@example.com,2002-11-28,0623431833,"79, rue Isaac Valette",65368,Huetboeuf,France,adjoint administratif administrative analyste en analyse de données avec 18 ans d'expérience,Blondel,35023,Pacsé(e),1,Doctorat,2022-03-08,2024-12-18 09:00:47,true,SMS,Cuisine
Frédéric,Vasseur,lucas52@example.com,1962-02-17,0689198562,avenue de Briand,49664,Sainte Benoît-les-Bains,France,assistant de gestion en PME responsable en cloud computing avec 8 ans d'expérience,Gomez,83269,Pacsé(e),0,Master,2024-12-28,2024-09-16 23:49:39,false,Courrier,"Cuisine, Technologie, Jeux vidéo, Mode"
Pénélope,François,matthieu71@example.com,1976-12-20,0745800146,"86, boulevard David Pires",97251,Perret-la-Forêt,France,technicien forestier forestière consultant en marketing digital avec 12 ans d'expérience,Boyer,70154,Pacsé(e),0,Master,2021-07-22,2024-12-03 14:41:21,true,Courrier,"Voyage, Mode, Cinéma"
Inès,Imbert,wfischer@example.org,1973-07-16,0686821,"20, chemin Godard",71709,Guillon-les-Bains,France,ingénieur nucléaire analyste en qualité avec 11 ans d'expérience,Blanc,103638,Divorcé(e),0,Licence,2024-12-24,2024-07-06 05:13:52,false,SMS,"Cinéma, Voyage"
