Éric,Fernandes,ochauvet@example.org,1959-04-12,0625394828,"69, rue Jeanne De Sousa",77790,Boyer-sur-Albert,France,consultant consultant en communication avec 17 ans d'expérience,Barre,116095,Célibataire,2,Master,2021-05-03,2024-07-18 00:31:17,false,SMS,"Musique, Technologie, Jeux vidéo, Voyage"
Émile,Simon,adrienne55@example.org,1965-08-22,0775803733,"38, avenue Lucie Deschamps",24573,Martineau,France,journaliste reporter d'images responsable en analyse de données avec 14 ans d'expérience,Navarro Olivier SARL,62893,Pacsé(e),2,Baccalauréat,2023-08-06,2025-04-23 14:44:56,true,Courrier,"Sport, Art"
David,Renault,bernard46@example.org,1962-11-20,0736065454,"9, rue Denise Toussaint",97346,Benoit-les-Bains,France,gérant de portefeuille conseiller en analyse de données avec 6 ans d'expérience,Girard,53751,Divorcé(e),3,Master,2024-11-24,2024-09-30 14:36:02,true,Email,"Jeux vidéo, Mode, Cuisine"
Patricia,Aubry,madeleinemary@example.org,1968-01-25,0719864378,"71, avenue de Regnier",90696,Saint Hortense-sur-Mer,France,matelot de la marine marchande technicien en cloud computing avec 11 ans d'expérience,Bourdon et Fils,117723,Célibataire,2,Master,2021-03-25,2024-11-18 01:34:30,true,Courrier,"Cinéma, Jeux vidéo, Musique"
Susanne,Mace,lacombechristiane@example.org,1998-11-16,0663669230,"3, rue Masson",87501,Laporte-sur-Besson,France,ingénieur pétrolier pétrolière technicien en sécurité informatique avec 9 ans d'expérience,Jourdan,53173,Veuf(ve),1,Doctorat,2022-05-08,2024-07-25 07:37:09,true,SMS,"Mode, Jeux vidéo"
Margaud,Benard,andreelanglois@example.org,1964-12-20,0772922713,"757, rue de Blin",44615,Lejeune,France,agronome analyste en gestion de projet avec 7 ans d'expérience,Neveu,74197,Divorcé(e),3,Licence,2022-10-27,2024-06-05 05:54:41,true,Téléphone,"Lecture, Voyage"
Chantal,Muller,vidaltheophile@example.com,1997-03-31,0645863170,"7, chemin de Barre",74626,Dumas,France,oenologue ingénieur en communication avec 7 ans d'expérience,Camus,59297,Pacsé(e),2,Licence,2020-07-17,2024-06-25 17:16:32,false,Email,"Cinéma, Cuisine"
Françoise,Leclercq,emarin@example.net,1976-09-18,0618646304,"16, rue Delattre",39734,Simonboeuf,France,marchandiseur responsable en logistique avec 14 ans d'expérience,Mercier S.A.,34995,Marié(e),4,Baccalauréat,2021-10-03,2025-04-05 17:10:34,true,Téléphone,Sport
Noémi,Masse,marchalmatthieu@example.net,2000-04-01,0650015089,"6, rue de Martineau",35826,Cordier,France,chef de cultures légumières analyste en cloud computing avec 12 ans d'expérience,Leleu,105095,Marié(e),0,Autre,2020-12-02,2025-03-07 02:04:39,false,Courrier,"Musique, Lecture, Cuisine"
Aimée,Hardy,fguerin@example.com,1962-06-12,0788350861,"234, avenue Jacob",97261,Marynec,France,ingénieur chimiste spécialisé en ressources humaines avec 8 ans d'expérience,Roger,58023,Célibataire,4,BTS/DUT,2022-09-05,2024-10-29 00:10:22,false,Courrier,"Technologie, Art"
Anne,Hardy,alixlesage@example.net,1984-08-18,0752836871,"24, chemin de Tessier",57831,Andre-les-Bains,France,conducteur de ligne de production alimentaire ingénieur en sécurité informatique avec 18 ans d'expérience,Lebrun Chartier SA,46400,Divorcé(e),0,Doctorat,2022-10-18,2024-11-13 01:21:45,true,SMS,"Cuisine, Mode, Jeux vidéo, Voyage"
Patrick,Becker,vwagner@example.com,2003-07-13,0681772411,"6, rue Rodrigues",97440,Saint Richard,France,technicien des industries du verre analyste en développement web avec 6 ans d'expérience,Lefèvre,98810,Divorcé(e),4,Baccalauréat,2025-02-12,2024-06-27 23:28:37,true,Email,"Jeux vidéo, Technologie, Musique"
Gabriel,Lacombe,ypottier@example.org,1975-07-18,063581106,"75, rue de Perrin",41224,Lecoqdan,France,traducteur-interprète ingénieur en marketing digital avec 3 ans d'expérience,Dumont Thomas S.A.,51342,Célibataire,3,Licence,2024-04-20,2024-08-06 02:54:46,true,Email,"Technologie, Cuisine, Art, Jeux vidéo"
Lucas,Ollivier,leleustephanie@example.org,2005-01-23,0616973629,"77, chemin de Louis",30291,Duhamel,France,sportif de haut niveau technicien en logistique avec 15 ans d'expérience,Lebon,39064,Célibataire,3,Licence,2020-07-25,2025-03-14 07:41:23,true,Courrier,"Mode, Voyage, Jeux vidéo, Art"
Rémy,Delahaye,asanchez@example.net,1954-05-15,0659445606,chemin Jacquot,21463,Sauvage,France,art-thérapeute ingénieur en sécurité informatique avec 20 ans d'expérience,Pierre,101654,Divorcé(e),1,Licence,2020-10-01,2024-12-20 08:40:56,true,Téléphone,"Lecture, Voyage"
Mathilde,Hervé,glopes@example.com,2003-04-14,0673927999,boulevard Théophile Petit,05793,Sainte Thierry,France,conducteur de train analyste en cloud computing avec 7 ans d'expérience,Da Costa,109032,Marié(e),4,Doctorat,2022-08-20,2025-04-06 02:29:55,true,Courrier,"Technologie, Jeux vidéo, Voyage"
Noël,Baudry,dianegomes@example.org,1985-04-17,068827629,"17, avenue de Lucas",89745,Guillonnec,France,horticulteur responsable en logistique avec 13 ans d'expérience,Le Roux,99550,Pacsé(e),2,Baccalauréat,2022-06-14,2024-09-04 20:02:59,true,Courrier,Cinéma
Alphonse,Riou,ralves@example.net,1992-08-18,0685653438,rue de Pichon,80729,LefèvreVille,France,charpentier bois consultant en gestion de projet avec 5 ans d'expérience,Gros Ferrand SA,63084,Divorcé(e),3,Licence,2023-04-18,2024-06-10 22:15:28,false,Téléphone,"Cinéma, Lecture"
Gilbert,Maréchal,fbecker@example.org,1952-10-24,0696199433,boulevard de Gaillard,17978,Meuniernec,France,ingénieur études et développement en logiciels de simulation conseiller en cloud computing avec 8 ans d'expérience,Evrard,78381,Célibataire,2,Autre,2022-07-19,2024-10-31 14:46:08,true,Téléphone,"Sport, Cuisine"
Anaïs,Pelletier,humbertetienne@example.net,1976-03-11,0753604753,"8, avenue Lecomte",57285,Collet,France,installateur en télécoms responsable en qualité avec 2 ans d'expérience,Letellier,94912,Marié(e),2,Doctorat,2021-10-29,2024-09-13 19:44:37,false,Courrier,Cuisine
Isaac,Hubert,edithmonnier@example.net,2001-02-19,0622667406,"70, rue de Vincent",28652,Dupré-la-Forêt,France,agent de développement local consultant en finance internationale avec 11 ans d'expérience,Mary S.A.R.L.,41668,Veuf(ve),1,Doctorat,2025-03-28,2025-01-04 05:01:39,false,Téléphone,"Musique, Cinéma"
Maurice,Parent,victormartin@example.net,1991-09-23,0746494705,rue de Toussaint,48862,Duval,France,technicien en métrologie ingénieur en marketing digital avec 13 ans d'expérience,Caron S.A.R.L.,47634,Divorcé(e),1,Master,2021-11-01,2024-12-17 16:46:21,true,SMS,"Art, Cinéma, Lecture, Jeux vidéo"
Suzanne,Dupré,emmanuelle67@example.net,1971-03-11,0612030845,"52, chemin de Leleu",79932,Saint Éric,France,plâtrier responsable en finance internationale avec 2 ans d'expérience,Gay,72344,Veuf(ve),1,Master,2024-01-17,2025-03-22 10:01:52,false,Email,"Cinéma, Voyage, Art, Sport"
Adrien,Hoarau,theodoremarty@example.org,1997-04-21,0684920663,"82, boulevard de Loiseau",92813,Saint Eugèneboeuf,France,restaurateur d'oeuvres d'art expert en marketing digital avec 13 ans d'expérience,Benoit,72320,Célibataire,0,Licence,2021-03-09,2025-02-18 00:35:16,false,Email,Sport
Anastasie,Descamps,petitjeancamille@example.net,1958-01-04,077894991,"43, rue Verdier",40162,Legros,France,architecte d'intérieur ingénieur en qualité avec 8 ans d'expérience,Delorme,91008,Marié(e),1,BTS/DUT,2022-12-19,2025-02-22 20:45:36,true,Téléphone,"Art, Cinéma, Mode"
Patrick,Le Roux,loiseaujulien@example.org,1977-08-18,068868568,"49, rue Margot Roux",05211,Arnaud-sur-Boulanger,France,ergothérapeute responsable en cloud computing avec 8 ans d'expérience,Fleury,30694,Divorcé(e),4,Licence,2021-06-07,2024-08-24 06:50:58,false,Courrier,"Lecture, Cinéma, Jeux vidéo"
Aurélie,Hubert,delormenoemi@example.net,1980-01-12,0749503752,"604, avenue de Mahe",79694,Blotnec,France,diététicien consultant en marketing digital avec 2 ans d'expérience,Riou S.A.,32777,Veuf(ve),0,Licence,2021-02-28,2024-10-24 21:29:59,true,SMS,"Sport, Musique"
Margot,Seguin,constancelamy@example.net,1972-06-16,0691388774,"75, boulevard Margot Hardy",37649,Loiseau,France,inséminateur conseiller en finance internationale avec 11 ans d'expérience,Blin,78920,Pacsé(e),1,BTS/DUT,2021-09-11,2025-04-16 10:03:37,false,Email,"Sport, Cuisine"
Sébastien,Pinto,colettelemaire@example.org,2004-01-19,0726203709,"127, avenue Le Gall",64374,Boucherboeuf,France,technicien automobile responsable en intelligence artificielle avec 20 ans d'expérience,Wagner,68797,Marié(e),4,BTS/DUT,2022-05-23,2024-11-27 02:48:09,true,Téléphone,"Voyage, Jeux vidéo, Sport"
Jacques,Ledoux,nleleu@example.com,1955-11-22,0643667844,"7, rue de Delaunay",15522,Labbé,France,bronzier conseiller en qualité avec 16 ans d'expérience,Bazin,31017,Divorcé(e),1,Doctorat,2022-09-02,2024-05-31 15:40:12,false,Téléphone,"Technologie, Musique, Mode"
Margot,Thibault,alexandriahubert@example.com,1956-12-02,0711922401,"99, rue Fontaine",23726,Hoarau-sur-Chartier,France,agent de constatation des douanes conseiller en ressources humaines avec 6 ans d'expérience,Collin,59408,Célibataire,2,Autre,2021-06-04,2025-03-13 23:19:56,false,Courrier,Lecture
Marcelle,Lemaire,odettecosta@example.com,1979-10-09,0670112565,"220, rue Bodin",05923,Sainte CélinaVille,France,maraîcher technicien en communication avec 19 ans d'expérience,Marion,94477,Célibataire,0,Autre,2021-02-11,2024-12-02 06:01:15,false,SMS,"Sport, Mode, Musique, Technologie"
Margot,Michel,pineaugeorges@example.net,1982-01-13,0635488918,"45, avenue Madeleine Petit",07574,Sainte LucasVille,France,substitut du procureur analyste en communication avec 18 ans d'expérience,Monnier,27566,Marié(e),4,BTS/DUT,2021-04-05,2024-06-29 08:07:29,true,Email,"Mode, Voyage"
Sophie,Jacques,thomasdelannoy@example.org,1951-10-19,0726511716,"91, rue Dupré",49930,Sainte Susanneboeuf,France,ingénieur support expert en logistique avec 5 ans d'expérience,Goncalves,112818,Marié(e),4,BTS/DUT,2022-08-15,2024-07-13 15:03:51,false,SMS,"Technologie, Mode, Art, Cinéma"
Sophie,Lacombe,thierry75@example.org,1964-11-08,0679342273,"8, avenue Barthelemy",54418,ColletBourg,France,responsable de réseau eau potable spécialisé en intelligence artificielle avec 4 ans d'expérience,Roger,91996,Marié(e),1,Autre,2022-09-12,2025-03-11 22:03:18,false,SMS,"Art, Sport, Lecture"
Adélaïde,Baron,honore34@example.net,1994-05-25,0646031685,"404, avenue Vidal",59157,Tanguy,France,masseur expert en cloud computing avec 6 ans d'expérience,Hoareau,85566,Veuf(ve),4,Licence,2022-12-12,2025-01-19 03:19:36,false,Email,Voyage
Élisabeth,Petit,zdelattre@example.net,1954-03-19,0667089,rue Patricia Meunier,67169,Descamps,France,conseiller en insertion sociale et professionnelle consultant en gestion de projet avec 11 ans d'expérience,Salmon,117201,Divorcé(e),3,Master,2021-12-23,2024-08-10 18:43:48,true,Email,"Musique, Cinéma"
Alexandrie,Faure,susan70@example.org,1966-01-01,0796736999,rue Paris,25725,Thierry,France,agent de propreté urbaine conseiller en gestion de projet avec 12 ans d'expérience,Gauthier,68139,Marié(e),3,Master,2024-05-31,2025-04-02 06:09:00,false,Email,Jeux vidéo
Frédéric,Fabre,olivier27@example.com,1989-10-22,065542625,"2, chemin de Samson",67945,Lopes-la-Forêt,France,militaire technicien de l'air (MTA) consultant en qualité avec 10 ans d'expérience,Bouvet et Fils,110006,Pacsé(e),3,Master,2023-10-11,2024-08-19 02:02:52,false,Téléphone,Lecture
Léon,Fabre,ppires@example.net,1986-11-23,0685881363,"7, rue Suzanne Pineau",42839,Sainte Catherinenec,France,cadreur responsable en ressources humaines avec 18 ans d'expérience,Blanc,76576,Divorcé(e),0,Baccalauréat,2020-06-13,2024-08-04 20:42:44,false,Email,Mode
Julien,Berger,williamdumas@example.com,2000-05-31,079646103,chemin Martin,47594,Weissdan,France,opérateur en traitement des matériaux ingénieur en analyse de données avec 16 ans d'expérience,Auger Duhamel S.A.R.L.,112837,Pacsé(e),4,Licence,2022-01-09,2024-05-05 03:12:34,true,SMS,"Voyage, Technologie"
Adélaïde,Gallet,franck56@example.net,1986-01-12,0636621738,"19, rue Corinne Charles",20512,Chauvet,France,architecte expert en finance internationale avec 15 ans d'expérience,Lenoir,78232,Marié(e),3,Licence,2025-04-21,2025-01-06 22:32:24,true,Courrier,"Art, Musique"
Zoé,Pages,laurencetexier@example.org,1955-08-06,0675961083,"12, rue Maurice",24205,Lesage-sur-Dumont,France,technicien d'analyses biomédicales technicien en intelligence artificielle avec 9 ans d'expérience,Roy,33030,Divorcé(e),0,Licence,2024-05-02,2025-03-17 19:42:51,true,Email,"Cuisine, Voyage, Technologie, Musique"
Geneviève,Leroux,lecoqbernadette@example.com,1965-07-28,0616078721,"185, boulevard Bouchet",27125,Bruneau,France,documentaliste spécialisé en sécurité informatique avec 20 ans d'expérience,Grondin S.A.R.L.,75067,Divorcé(e),3,BTS/DUT,2023-12-20,2025-02-02 21:05:25,false,Email,"Cinéma, Lecture, Art"
Louise,Blin,xbouchet@example.com,1954-02-18,0649147239,"7, chemin Breton",23246,Guillot,France,responsable du service après-vente expert en intelligence artificielle avec 9 ans d'expérience,Dos Santos,116241,Célibataire,2,Baccalauréat,2024-01-13,2024-09-06 12:20:46,true,Courrier,"Art, Cuisine"
Susanne,Bertrand,ponsines@example.com,2001-09-12,0736745884,rue Gay,43586,Julien,France,consultant responsable en cloud computing avec 17 ans d'expérience,Bonnet Clément et Fils,37866,Divorcé(e),4,Baccalauréat,2022-10-30,2025-04-08 13:14:11,true,Email,"Cuisine, Lecture, Sport, Cinéma"
Gabriel,Moreno,sauvageclaudine@example.com,1964-05-06,0636884860,"61, chemin Lopez",46146,Pages-sur-Paul,France,conseiller agricole consultant en communication avec 11 ans d'expérience,Rivière Faure S.A.,68210,Pacsé(e),2,Doctorat,2023-01-25,2024-05-13 04:20:33,true,Email,Jeux vidéo
Marine,Jacquot,dgimenez@example.com,2001-04-18,0734595382,"73, avenue de Toussaint",95633,Boutin-les-Bains,France,technicien plasturgiste conseiller en marketing digital avec 17 ans d'expérience,Hervé Masse S.A.R.L.,100726,Pacsé(e),1,Licence,2021-12-03,2024-11-18 10:17:06,true,Téléphone,"Sport, Lecture, Art, Technologie"
Alain,Maillard,alex23@example.org,1991-01-09,073044053,"8, boulevard de Raymond",23187,Georges-sur-Mercier,France,juriste en propriété intellectuelle responsable en gestion de projet avec 12 ans d'expérience,Techer et Fils,45534,Célibataire,1,Doctorat,2022-01-23,2024-06-04 20:31:32,false,Téléphone,"Cuisine, Voyage, Jeux vidéo, Mode"
Édouard,Blin,seguinconstance@example.org,1952-02-04,0621950890,"21, chemin de Verdier",69909,Dupuis,France,responsable du soutien logistique intégré technicien en sécurité informatique avec 3 ans d'expérience,Charrier SARL,56675,Célibataire,0,Baccalauréat,2021-11-27,2024-08-23 15:30:54,false,SMS,Voyage
Constance,Garcia,kgimenez@example.net,1996-05-21,0663072420,chemin Dominique Renaud,53603,Delaunaynec,France,linguiste ingénieur en cloud computing avec 9 ans d'expérience,Legendre,98456,Célibataire,3,Baccalauréat,2021-01-11,2024-10-11 01:28:12,false,Courrier,"Technologie, Art"
Michel,Robin,perrotfrancoise@example.com,1968-07-04,0755432714,"2, avenue Pages",89533,Grégoire-sur-Neveu,France,consultant SaaS conseiller en gestion de projet avec 10 ans d'expérience,Martin,43281,Divorcé(e),2,BTS/DUT,2021-11-11,2024-08-20 15:03:40,false,Courrier,"Art, Musique"
Alexandrie,Vallet,celinagauthier@example.net,1978-05-31,0699042192,"740, chemin de Clerc",25473,Sainte Bertrand,France,responsable assurance qualité conseiller en développement web avec 15 ans d'expérience,Muller SA,60098,Célibataire,3,Licence,2022-10-09,2024-05-29 15:39:57,true,Email,"Jeux vidéo, Technologie"
Sylvie,Lemaître,mauriceedith@example.com,1983-01-31,076725953,rue Sabine Renault,66748,Étiennedan,France,apiculteur spécialisé en logistique avec 17 ans d'expérience,Legendre,40832,Célibataire,1,Master,2023-08-12,2024-05-21 12:16:06,true,Téléphone,"Technologie, Cuisine"
Denise,Boutin,mjulien@example.net,1961-01-23,0693633703,"3, rue Buisson",47423,Lévy,France,prototypiste en matériaux souples responsable en logistique avec 2 ans d'expérience,Navarro Rousseau et Fils,43209,Pacsé(e),2,Doctorat,2023-09-20,2025-02-17 07:55:23,true,Téléphone,"Voyage, Technologie, Lecture"
Jacqueline,Courtois,dtecher@example.com,1961-05-22,0768081383,chemin Christophe Mary,87184,Sainte Hortense,France,technicien de contrôle conseiller en développement web avec 16 ans d'expérience,Gillet,63820,Pacsé(e),1,BTS/DUT,2021-01-21,2024-07-20 00:36:44,true,SMS,"Sport, Art"
Luc,Boutin,speltier@example.org,1994-11-10,065223334,"3, boulevard Perrin",20184,Foucher,France,militaire technicien de l'air (MTA) expert en analyse de données avec 6 ans d'expérience,Muller Lebrun S.A.,61366,Célibataire,3,Doctorat,2020-11-22,2024-11-23 10:08:17,false,Courrier,"Jeux vidéo, Mode, Cuisine"
David,Guillet,fouchernathalie@example.org,1979-01-27,0694081537,"51, boulevard Inès Vidal",70232,Bigot,France,souscripteur consultant en cloud computing avec 6 ans d'expérience,Delattre Chrétien SA,106661,Marié(e),2,BTS/DUT,2022-07-23,2024-05-25 13:04:49,false,SMS,"Lecture, Musique, Sport"
Marine,Devaux,bernadette37@example.com,1958-04-05,0659478347,"40, rue Charlotte Turpin",45579,Masse,France,enseignant d'art conseiller en sécurité informatique avec 18 ans d'expérience,Meyer S.A.R.L.,83857,Divorcé(e),4,Baccalauréat,2022-01-24,2024-10-17 03:06:50,true,Téléphone,"Voyage, Lecture, Jeux vidéo, Cuisine"
Madeleine,Fouquet,bernardcaron@example.com,1959-01-15,0648121940,"72, boulevard de Joly",63207,Charles,France,directeur d'office de tourisme expert en intelligence artificielle avec 6 ans d'expérience,Giraud Marion S.A.R.L.,55415,Veuf(ve),0,Doctorat,2023-11-14,2025-03-07 01:41:55,false,SMS,Musique
Célina,Duval,zjourdan@example.net,1962-06-29,0630561009,"82, avenue de Perret",65725,Guyot,France,carrossier expert en développement web avec 9 ans d'expérience,Richard et Fils,100530,Marié(e),4,Licence,2022-08-31,2025-03-22 10:17:15,false,SMS,Voyage
Adélaïde,Becker,charrierroger@example.net,1964-06-20,0627046522,"84, avenue Thomas",88750,Saint Jacqueline-la-Forêt,France,responsable de la promotion des ventes ingénieur en gestion de projet avec 15 ans d'expérience,François,26817,Divorcé(e),1,Licence,2022-05-21,2025-03-07 01:45:11,false,Email,"Jeux vidéo, Sport, Art"
Nicolas,Berthelot,charlespires@example.com,1968-01-17,0634715053,"71, boulevard de Letellier",97486,Gillet,France,rédacteur on line analyste en cloud computing avec 13 ans d'expérience,Fabre,86915,Marié(e),1,Doctorat,2023-09-09,2024-12-25 09:43:47,true,SMS,Voyage
Joseph,Michel,fdelorme@example.com,1987-10-03,0650269292,"2, avenue de Bègue",94707,Joubert,France,ingénieur hydroécologue conseiller en intelligence artificielle avec 17 ans d'expérience,Lopez et Fils,117533,Marié(e),1,Doctorat,2024-11-15,2024-06-27 08:41:31,true,Téléphone,"Art, Jeux vidéo, Technologie"
Éléonore,Blondel,ribeiropierre@example.org,1988-02-09,0676534589,"34, rue de Lefebvre",97644,Munoz,France,officier de la Marine nationale ingénieur en communication avec 4 ans d'expérience,Schmitt,93425,Divorcé(e),1,Master,2021-06-16,2024-05-27 23:55:12,false,Email,Sport
Michèle,Maillet,bleger@example.org,1997-10-08,0631659503,"283, avenue de Lemaître",94137,Sainte DavidVille,France,éducateur technique spécialisé technique spécialisée expert en intelligence artificielle avec 3 ans d'expérience,Lebrun Samson SARL,89126,Pacsé(e),2,Autre,2022-02-28,2024-09-16 17:04:08,true,Email,"Technologie, Voyage, Mode, Jeux vidéo"
Jérôme,Dias,simone35@example.org,1974-06-08,0769956146,"93, rue de Marin",09537,Saint Susan,France,ingénieur d'études en sûreté nucléaire technicien en finance internationale avec 6 ans d'expérience,Hamel SA,30343,Célibataire,2,BTS/DUT,2022-10-01,2024-05-30 07:14:43,false,Courrier,"Lecture, Voyage"
Maryse,Dumont,martinraymond@example.net,1954-06-19,0739674603,"5, boulevard Techer",84729,Brunel,France,conducteur d'engins forestiers de récolte en entreprises de travaux forestiers expert en qualité avec 13 ans d'expérience,Baudry S.A.,67081,Célibataire,2,Master,2020-09-08,2025-04-04 07:50:23,true,Téléphone,"Musique, Art"
Élise,Chauveau,maheolivie@example.com,1974-04-23,0649904204,"89, rue Caroline Leroy",50341,Bonnin,France,microbiologiste conseiller en gestion de projet avec 4 ans d'expérience,Boucher Torres et Fils,61393,Pacsé(e),3,Master,2022-08-14,2025-02-21 17:20:33,true,SMS,"Musique, Technologie, Lecture, Art"
Paul,Weber,gerard88@example.org,1981-06-27,0639261596,rue de Bruneau,50532,Sainte Célina-la-Forêt,France,professeur des écoles des écoles consultant en cloud computing avec 18 ans d'expérience,Lambert SA,56251,Marié(e),3,Master,2023-08-09,2025-02-25 18:40:49,false,SMS,"Cuisine, Cinéma, Musique"
Zoé,Pascal,ponssuzanne@example.org,1970-09-12,063604254,boulevard Valentine Girard,10660,Bourdon-les-Bains,France,auteur-compositeur interprète interprète technicien en cloud computing avec 13 ans d'expérience,Allard S.A.,116087,Veuf(ve),0,Doctorat,2023-09-01,2024-12-29 04:06:55,true,SMS,"Voyage, Art"
Maggie,Breton,bessonarnaude@example.net,1985-11-08,0659262541,rue de Maillard,97377,Mullerboeuf,France,technicien de maintenance en génie climatique ingénieur en communication avec 5 ans d'expérience,Cohen S.A.R.L.,107336,Célibataire,1,Autre,2024-10-09,2024-10-10 17:04:09,false,Courrier,"Musique, Cuisine"
Anne,Monnier,martinsjuliette@example.org,1987-10-22,0782961495,"80, rue Thibaut Leconte",45623,Jourdan-sur-Seguin,France,climatologue technicien en cloud computing avec 20 ans d'expérience,Gilbert S.A.,44523,Célibataire,2,BTS/DUT,2021-10-06,2024-07-12 14:08:46,false,Email,Voyage
Renée,Couturier,wjoseph@example.org,1995-02-02,0746673257,"76, boulevard Germain",17537,Petitjean,France,décorateur technicien en intelligence artificielle avec 6 ans d'expérience,Rodrigues,40949,Célibataire,4,BTS/DUT,2023-11-30,2025-01-27 21:56:48,false,Email,"Art, Voyage, Mode, Lecture"
Louise,Peron,gabrielle57@example.net,1951-05-03,0698045873,boulevard de Étienne,05663,Brunet,France,ingénieur production en aéronautique conseiller en finance internationale avec 2 ans d'expérience,Vincent Teixeira SA,36425,Veuf(ve),0,Doctorat,2025-02-10,2025-04-08 08:00:58,false,Email,"Cinéma, Jeux vidéo"
Étienne,Hervé,bfontaine@example.org,1978-07-02,0616192503,"4, rue de Texier",55690,Royer-la-Forêt,France,ascensoriste ingénieur en communication avec 2 ans d'expérience,Merle,114015,Divorcé(e),4,Baccalauréat,2021-08-28,2024-06-06 15:35:58,false,SMS,Musique
Françoise,Roger,pjulien@example.net,1984-03-17,0714213722,"92, boulevard de Perez",31323,Brun-sur-Mer,France,conducteur de métro expert en communication avec 7 ans d'expérience,Arnaud S.A.R.L.,70203,Pacsé(e),4,Autre,2025-02-18,2024-05-03 17:16:38,false,Email,"Voyage, Sport, Jeux vidéo"
Nath,Boutin,elisebouvier@example.net,1955-05-03,0726253576,"98, chemin Margaud Maillet",08752,Baron,France,technicien prototypiste en agroéquipement consultant en sécurité informatique avec 17 ans d'expérience,Gros David S.A.S.,82881,Marié(e),0,Master,2022-06-08,2024-09-13 16:17:46,true,Email,"Musique, Voyage"
Joseph,Monnier,colette43@example.net,1981-07-23,0677088173,"59, avenue Nathalie Lebrun",06736,Gomez,France,conseiller d'élevage conseiller en qualité avec 18 ans d'expérience,Berthelot,34525,Pacsé(e),2,Autre,2021-05-31,2024-11-15 21:22:41,false,Téléphone,"Lecture, Jeux vidéo, Musique, Cinéma"
Élodie,Hamel,ulaporte@example.org,1964-06-16,0629812228,chemin Le Roux,06172,Lacombe,France,testeur expert en cloud computing avec 7 ans d'expérience,Chauvin Lemoine SARL,64671,Célibataire,3,Doctorat,2023-02-25,2024-07-29 07:44:11,true,Email,"Cinéma, Sport, Voyage"
Charles,Moreno,rcarpentier@example.org,1983-08-03,0679806949,"46, chemin de Prévost",27183,Leleudan,France,ingénieur plasturgiste analyste en intelligence artificielle avec 14 ans d'expérience,Bouvier,32885,Marié(e),4,Doctorat,2020-07-18,2024-06-22 10:32:58,true,SMS,"Technologie, Cinéma, Art"
Philippine,Fontaine,susannerenaud@example.com,1964-10-15,0664066889,avenue Élise Evrard,49105,Guilletdan,France,dessinateur de BD analyste en logistique avec 7 ans d'expérience,Leduc,117821,Pacsé(e),2,Baccalauréat,2022-04-10,2025-01-01 06:57:13,false,Téléphone,"Cuisine, Sport, Jeux vidéo, Art"
Élisabeth,Bouchet,lorraine20@example.net,1973-07-10,0644096077,"7, rue Bertrand Léger",83877,Petit,France,technicien prototypiste en agroéquipement conseiller en gestion de projet avec 8 ans d'expérience,Descamps,99892,Veuf(ve),3,Autre,2024-04-24,2024-05-13 09:15:58,true,SMS,Voyage
Auguste,Lopez,fwagner@example.net,1981-10-14,0657643899,"28, chemin Noël Daniel",60451,Hebert,France,technicien radioprotection ingénieur en ressources humaines avec 5 ans d'expérience,Daniel,36783,Célibataire,1,Baccalauréat,2020-08-22,2025-01-23 03:36:26,true,Email,"Art, Cinéma, Jeux vidéo"
Daniel,Collin,rogerlopez@example.org,1978-12-18,0618063944,"3, chemin de Rey",04513,Marty,France,psychologue analyste en analyse de données avec 13 ans d'expérience,Baudry,79958,Divorcé(e),1,Licence,2020-06-22,2024-08-14 10:35:40,true,Email,"Sport, Cuisine, Musique, Jeux vidéo"
Pénélope,Leblanc,laurentrey@example.com,1956-07-06,0723980762,avenue Stéphane Aubert,01817,Philippe-les-Bains,France,ingénieur production en aéronautique expert en ressources humaines avec 3 ans d'expérience,Guérin SARL,92387,Marié(e),4,Baccalauréat,2022-08-18,2024-07-19 19:16:39,false,Email,"Jeux vidéo, Mode, Musique, Cinéma"
Anne,Morvan,matthieu91@example.org,2002-06-04,0688857445,"9, avenue de Guyon",53863,Baronnec,France,ingénieur RD en énergies renouvelables responsable en sécurité informatique avec 11 ans d'expérience,Martineau Perez et Fils,80533,Célibataire,1,Autre,2022-09-09,2025-02-11 05:56:21,false,Courrier,Cuisine
