Matthieu,Sauvage,bertrandbernard@example.org,1989-08-25,0726930380,"47, chemin de Raynaud",68616,Mendès-la-Forêt,France,ingénieur maintenance aéronautique consultant en finance internationale avec 12 ans d'expérience,Da Silva Fontaine SA,95120,Divorcé(e),4,BTS/DUT,2022-03-14,2024-07-08 02:16:19,false,SMS,"Cuisine, Lecture"
Adèle,Lopes,frederic26@example.com,1978-07-31,0795359455,boulevard François,10896,Humbert,France,ingénieur électricien technicien en communication avec 11 ans d'expérience,Tessier,83120,Pacsé(e),0,Autre,2022-03-29,2024-07-19 01:17:26,false,Email,"Cuisine, Cinéma, Voyage"
Benjamin,Lecoq,cjean@example.com,1964-01-26,074266110,"33, chemin de Letellier",29254,Chevalier,France,bijoutier-joaillier ingénieur en intelligence artificielle avec 17 ans d'expérience,Martineau,106349,Veuf(ve),1,Licence,2021-11-30,2024-07-01 23:40:36,true,Email,"Jeux vidéo, Cuisine"
Laetitia,Huet,munozmanon@example.net,2000-08-05,0711749445,"78, chemin Isaac Techer",77508,Guillet-la-Forêt,France,chef de projet démantèlement nucléaire spécialisé en analyse de données avec 4 ans d'expérience,Albert Lefebvre S.A.,35057,Célibataire,2,BTS/DUT,2022-02-11,2024-05-26 22:05:24,false,SMS,"Art, Jeux vidéo"
Laure,Gonzalez,celinedelahaye@example.org,1951-05-30,0788617209,"80, rue de Launay",57204,Sauvage-sur-Le Roux,France,chargé d'études ressources humaines conseiller en gestion de projet avec 9 ans d'expérience,Morel Coste S.A.R.L.,107989,Célibataire,3,BTS/DUT,2021-07-31,2024-08-10 18:03:47,false,SMS,"Jeux vidéo, Cuisine, Cinéma"
Claire,Leroy,schmittelise@example.org,2001-11-09,0788676619,"3, rue Rodriguez",67389,Sainte Valérie,France,astrophysicien responsable en logistique avec 9 ans d'expérience,Rey S.A.R.L.,79327,Divorcé(e),4,BTS/DUT,2023-07-31,2025-04-18 22:26:54,false,SMS,"Mode, Voyage, Sport"
Josette,Delattre,ublondel@example.org,1954-03-05,0629273030,"58, rue Chauveau",78220,Sainte Vincent,France,chargé de clientèle banque analyste en communication avec 2 ans d'expérience,Nicolas Lecomte SA,33784,Pacsé(e),3,Master,2023-08-31,2025-01-09 17:04:44,true,Téléphone,"Mode, Jeux vidéo, Lecture, Sport"
Guillaume,Regnier,sophiegomez@example.net,1976-04-21,0748963492,"4, rue Carre",91315,Loiseau,France,nivoculteur responsable en qualité avec 11 ans d'expérience,Boulay Rey S.A.S.,112710,Veuf(ve),4,Doctorat,2025-02-24,2025-02-20 12:16:36,true,Téléphone,"Lecture, Mode, Voyage"
Claude,Descamps,bouchercharlotte@example.org,1983-02-06,0680368387,"39, avenue Lecomte",33903,Sainte Théodore-sur-Mer,France,régleur conseiller en sécurité informatique avec 8 ans d'expérience,Bruneau Cordier S.A.S.,61438,Célibataire,1,Master,2022-03-30,2025-02-27 02:39:35,false,Courrier,Musique
Pauline,Caron,dsamson@example.net,1995-11-30,0768136929,"655, rue de Jourdan",41469,Sainte PauletteVille,France,professeur de mathématiques ou de physique-chimie spécialisé en communication avec 17 ans d'expérience,Royer Lebrun S.A.,102472,Marié(e),2,Licence,2022-02-28,2025-03-04 00:50:40,false,Téléphone,"Jeux vidéo, Sport, Voyage"
Marthe,Aubry,lebretonmathilde@example.org,1996-04-23,067878058,"28, rue de Schmitt",53171,Guillot-sur-Marie,France,responsable de projets culturels consultant en cloud computing avec 5 ans d'expérience,Leclercq Delaunay et Fils,63806,Célibataire,3,Doctorat,2022-08-13,2024-06-15 04:43:18,true,Téléphone,"Lecture, Art"
Philippine,Hervé,hortense64@example.org,1964-09-28,0655298408,"1, rue Pons",37769,Thomas-sur-Bernier,France,sellier consultant en marketing digital avec 17 ans d'expérience,Guilbert,76711,Veuf(ve),3,Baccalauréat,2023-06-06,2024-09-20 23:21:13,false,SMS,Art
Louise,Meunier,sebastien40@example.net,2004-06-26,0784512671,avenue Schneider,88786,Chevalier,France,conseiller agricole expert en développement web avec 18 ans d'expérience,Duval,40010,Veuf(ve),1,BTS/DUT,2023-11-09,2025-01-12 13:08:46,false,SMS,"Voyage, Mode, Musique"
Théophile,Jourdan,celina12@example.net,2005-05-18,0642815338,"36, avenue de Hoarau",12717,Clément,France,ingénieur d'études en sûreté nucléaire expert en qualité avec 11 ans d'expérience,Vallet Diaz S.A.R.L.,114633,Pacsé(e),0,Doctorat,2025-02-02,2025-01-19 00:40:37,false,SMS,"Cuisine, Jeux vidéo"
Jeanne,Gros,dupuisphilippine@example.org,1957-05-19,0633897886,"885, chemin de Mahe",97631,Adamnec,France,hydrogéologue spécialisé en gestion de projet avec 3 ans d'expérience,Martineau Pinto S.A.,88778,Divorcé(e),0,Baccalauréat,2023-07-23,2024-11-04 18:42:03,false,Email,"Cinéma, Cuisine"
Raymond,Peron,francoiseturpin@example.net,1997-02-05,0741731930,"47, rue Zoé Perrier",03689,Deschamps-la-Forêt,France,formulateur technicien en communication avec 2 ans d'expérience,Tanguy Lecoq S.A.,95795,Pacsé(e),3,Baccalauréat,2022-11-18,2024-06-15 04:59:13,true,SMS,"Cinéma, Voyage, Musique, Mode"
Laetitia,Martinez,cboulanger@example.com,1985-10-20,0618975647,"39, avenue Alex Laine",95260,Lebrun-sur-Brunel,France,géomaticien responsable en cloud computing avec 13 ans d'expérience,Jacob Munoz et Fils,87703,Marié(e),3,Autre,2021-10-25,2024-05-29 14:45:49,false,Email,"Voyage, Sport"
Lucas,Blot,josettemichel@example.com,1985-08-08,068706865,"35, chemin de Hubert",16556,Sainte Guydan,France,économètre statisticien analyste en analyse de données avec 16 ans d'expérience,Marty,109077,Marié(e),1,Master,2020-11-26,2024-04-29 05:55:48,false,Email,"Mode, Voyage, Sport"
Jérôme,Benoit,julienalain@example.org,1979-10-18,0716528821,"54, rue Noël Roussel",14449,Sainte Thérèse,France,technicien en optique de précision conseiller en intelligence artificielle avec 3 ans d'expérience,Fernandez,53492,Veuf(ve),1,Baccalauréat,2021-08-16,2025-03-02 08:48:50,true,Courrier,"Lecture, Sport, Mode"
Valérie,Lucas,pineauoceane@example.org,1980-03-08,076316284,"80, chemin de Raynaud",52765,LaunayBourg,France,ingénieur gaz expert en finance internationale avec 11 ans d'expérience,Poirier,86722,Divorcé(e),0,BTS/DUT,2022-11-15,2024-05-15 05:58:41,true,Email,"Technologie, Cinéma, Mode, Musique"
Lorraine,Carre,helene46@example.net,1983-03-17,0758326038,"11, chemin Gros",03647,Lenoirnec,France,audioprothésiste spécialisé en développement web avec 4 ans d'expérience,Charles,71607,Marié(e),1,Autre,2020-11-05,2024-10-01 10:34:50,true,SMS,Cuisine
Margaud,Vaillant,charles93@example.com,2003-02-10,0730610705,"418, boulevard Alexandre Ferreira",28452,Camus,France,professeur dans l'enseignement agricole consultant en qualité avec 2 ans d'expérience,Renaud Valentin et Fils,61816,Divorcé(e),1,BTS/DUT,2024-02-12,2025-03-26 03:18:20,false,Téléphone,Jeux vidéo
Alexandre,Bonneau,philippineprevost@example.com,1957-10-23,0759298497,"43, avenue Samson",09658,Moreno,France,responsable de rémunération responsable en logistique avec 11 ans d'expérience,Morin SARL,111961,Marié(e),4,Doctorat,2021-10-21,2025-01-01 19:17:07,true,Téléphone,"Jeux vidéo, Voyage"
Corinne,Camus,ledouxjules@example.org,1991-11-28,0737240934,"25, rue Brunel",68361,Sainte Christophe,France,ingénieur production en mécanique spécialisé en qualité avec 12 ans d'expérience,Perrier Gosselin S.A.,113228,Divorcé(e),3,Doctorat,2022-10-25,2024-06-08 02:07:51,false,Téléphone,Mode
Juliette,Boucher,couturiergilles@example.net,1986-04-15,0727520388,"9, rue de Delannoy",26414,CarreBourg,France,bactériologiste expert en marketing digital avec 14 ans d'expérience,Barbe Laine S.A.S.,51280,Marié(e),2,Licence,2025-03-13,2025-03-22 15:48:52,false,Courrier,"Musique, Cuisine, Sport, Cinéma"
Christelle,Buisson,heberttherese@example.org,1991-08-13,079584657,"21, avenue de Jacquot",14991,Joubert,France,ingénieur télécoms et réseaux analyste en communication avec 11 ans d'expérience,Aubert,95849,Célibataire,3,Autre,2024-07-31,2024-06-01 15:17:49,false,Courrier,"Jeux vidéo, Cinéma, Musique"
Catherine,Martins,tmendes@example.net,1996-09-30,0689883426,"25, rue Lucy Barthelemy",21899,Pottier,France,conducteur de machines à papier conseiller en cloud computing avec 7 ans d'expérience,Perrin,59873,Divorcé(e),3,Autre,2020-11-17,2025-02-14 23:59:15,true,Courrier,"Art, Voyage, Technologie, Jeux vidéo"
Antoinette,Sanchez,herveauguste@example.org,1984-06-10,0749679691,"77, rue Bailly",78757,Dubois,France,géophysicien technicien en communication avec 13 ans d'expérience,Breton,94186,Pacsé(e),0,Autre,2024-01-29,2024-11-14 16:37:16,false,Téléphone,"Voyage, Technologie"
Louise,Antoine,guy11@example.org,2000-08-18,0618827483,"9, rue Rolland",71821,Thibault,France,illustrateur consultant en logistique avec 7 ans d'expérience,Gautier,96327,Célibataire,4,Doctorat,2024-10-07,2024-08-07 04:10:56,false,Email,"Sport, Mode, Cinéma"
Juliette,Lopes,catherinede-sousa@example.com,1970-05-24,0738116608,chemin Valentin,80764,Aubert-les-Bains,France,chef de projet packaging responsable en marketing digital avec 9 ans d'expérience,Buisson,117345,Veuf(ve),2,Baccalauréat,2021-02-10,2025-02-13 17:51:47,true,SMS,Musique
Valentine,Guillaume,wgomez@example.net,1954-10-18,0679115177,"7, rue Torres",64710,Meunier,France,charpentier métallique analyste en développement web avec 10 ans d'expérience,Laroche Delannoy S.A.,75719,Marié(e),4,Licence,2024-05-09,2025-01-23 00:08:23,false,Courrier,"Voyage, Sport, Cuisine, Musique"
Christophe,Pelletier,grolland@example.org,2001-10-25,0674070553,rue de Thierry,52560,Weiss-sur-Mer,France,conducteur de machine onduleuse consultant en marketing digital avec 10 ans d'expérience,Dupuis,107939,Divorcé(e),4,Doctorat,2023-04-16,2024-08-08 02:07:06,true,Email,Mode
Théophile,Bonneau,margaret70@example.org,1960-08-01,0780916076,boulevard Durand,97454,François,France,professeur de musique et de danse conseiller en marketing digital avec 3 ans d'expérience,Maury S.A.,45912,Pacsé(e),3,Licence,2024-03-03,2024-09-25 05:04:02,false,SMS,"Technologie, Lecture"
Sabine,Lecoq,grosanne@example.net,1970-08-02,0722588863,"429, rue Georges",95135,Benoitboeuf,France,boucher responsable en cloud computing avec 9 ans d'expérience,Loiseau Dupont S.A.S.,64285,Veuf(ve),1,Licence,2024-10-26,2024-12-16 12:51:51,false,Courrier,Musique
Timothée,Vincent,aguillet@example.org,1978-05-28,0664844836,"190, rue de Berthelot",36558,Millet,France,employé d'élevage spécialisé en développement web avec 9 ans d'expérience,Hoareau,44446,Pacsé(e),1,BTS/DUT,2025-02-18,2024-11-30 15:46:40,false,Courrier,"Voyage, Jeux vidéo"
Élise,Riou,bertrand50@example.com,1998-07-20,0656344813,"13, rue Georges Pons",88737,Collin-les-Bains,France,électromécanicien en remontées mécaniques expert en développement web avec 17 ans d'expérience,Hebert S.A.S.,113566,Célibataire,1,Doctorat,2025-03-06,2024-09-20 23:27:48,false,Téléphone,Voyage
Stéphane,Maillard,claudinebonnet@example.net,1999-12-17,0649116759,chemin Cécile Brunel,13691,Laurent,France,technicien radioprotection expert en analyse de données avec 15 ans d'expérience,Bailly,94907,Marié(e),4,BTS/DUT,2021-10-25,2024-09-21 05:54:13,false,Email,"Lecture, Voyage, Cuisine"
Aurore,Gilbert,legrosjoseph@example.net,1971-12-06,0672919341,"452, chemin de Le Goff",26448,Moreno,France,maroquinier expert en ressources humaines avec 7 ans d'expérience,Meyer,92858,Veuf(ve),0,BTS/DUT,2023-12-22,2025-03-07 21:57:56,false,Email,"Mode, Jeux vidéo"
Marcel,Guillon,levychristophe@example.org,1988-08-28,0753657556,"20, avenue Guyot",15186,Bruneau,France,géothermicien spécialisé en sécurité informatique avec 5 ans d'expérience,Poulain Guyon SA,95174,Célibataire,1,Doctorat,2023-09-22,2024-05-30 08:21:38,true,Téléphone,"Mode, Cinéma"
Pierre,Baron,kgrondin@example.org,2005-07-15,0771439893,"22, rue Weber",89901,Sainte Michel-sur-Mer,France,développeur informatique conseiller en gestion de projet avec 13 ans d'expérience,Salmon et Fils,117277,Marié(e),1,Master,2023-12-28,2025-04-03 21:24:03,false,Téléphone,"Cuisine, Musique"
Christelle,Alves,stephanie72@example.org,1988-06-23,076351282,"4, chemin Maury",06851,Saint Joseph,France,directeur d'hôtel expert en logistique avec 4 ans d'expérience,Goncalves,90215,Marié(e),4,Licence,2024-12-01,2025-01-21 03:25:53,false,Email,"Voyage, Cuisine, Sport, Lecture"
Lucas,Marchal,anne40@example.net,1988-04-11,0782680596,"243, rue de Moulin",14596,Caron,France,gestionnaire actif/passif responsable en cloud computing avec 3 ans d'expérience,De Oliveira,73875,Pacsé(e),0,BTS/DUT,2022-05-11,2024-05-15 19:07:57,true,Téléphone,Sport
Noël,Collet,guillaumemarc@example.com,1973-12-05,0630280979,"140, avenue Alix Turpin",89700,Le Goff,France,chercheur en chimie analyste en sécurité informatique avec 17 ans d'expérience,Turpin Boyer SARL,44666,Marié(e),2,Doctorat,2024-05-02,2024-09-07 15:53:30,false,SMS,Cuisine
Émile,Martineau,clercstephane@example.org,2004-07-09,0782486568,"82, rue de Ramos",56958,Lebreton,France,orthoprothésiste expert en sécurité informatique avec 11 ans d'expérience,Pereira Pinto S.A.,28187,Marié(e),0,BTS/DUT,2023-07-20,2024-09-17 20:27:26,false,SMS,"Cuisine, Voyage"
Louis,Normand,ilemaitre@example.com,2001-06-16,0733066093,"186, chemin de Perrier",49850,Saint Philippinenec,France,éducateur spécialisé spécialisée spécialisé en ressources humaines avec 7 ans d'expérience,Mallet Petitjean S.A.R.L.,58597,Marié(e),4,Baccalauréat,2021-03-06,2024-05-11 16:18:17,false,SMS,Art
Vincent,Lecomte,lambertfrederique@example.net,1955-07-17,0636362991,"16, rue Antoinette Pons",93274,Voisin-la-Forêt,France,actuaire conseiller en gestion de projet avec 10 ans d'expérience,Lévy Millet S.A.S.,92217,Divorcé(e),1,BTS/DUT,2021-07-31,2024-04-30 08:57:40,false,Email,"Jeux vidéo, Art, Voyage, Sport"
Julie,Fernandez,stephanemaillet@example.com,1972-05-04,0693604624,"42, avenue Maillard",91757,Blanc,France,responsable biométrie expert en intelligence artificielle avec 12 ans d'expérience,Perrot Poulain et Fils,79836,Veuf(ve),2,Autre,2024-01-17,2024-06-28 00:58:27,true,SMS,"Cuisine, Technologie, Sport"
Emmanuel,Daniel,antoinettethibault@example.net,1991-08-26,0794268635,"99, chemin Louis Gonzalez",45647,Andre-sur-Faivre,France,archéologue conseiller en finance internationale avec 4 ans d'expérience,Gomez SARL,32488,Pacsé(e),3,Baccalauréat,2020-07-22,2024-10-22 12:03:03,false,SMS,"Cuisine, Art, Sport, Voyage"
Alfred,Loiseau,julienandree@example.net,1984-02-07,0638382571,"25, rue Théodore Regnier",22324,MalletVille,France,hôtesse de l'air technicien en qualité avec 2 ans d'expérience,Leroy S.A.R.L.,81469,Divorcé(e),0,BTS/DUT,2024-01-13,2024-12-19 01:51:19,true,Téléphone,"Technologie, Lecture, Cuisine"
Madeleine,Leduc,charlesmaillet@example.com,1998-05-08,0618732007,"7, chemin de Maillet",85580,Collet-sur-Mahe,France,ingénieur calcul analyste en marketing digital avec 5 ans d'expérience,Lévêque SARL,92820,Veuf(ve),3,Baccalauréat,2020-12-31,2025-01-04 00:52:20,false,Email,"Technologie, Jeux vidéo, Mode"
Susan,Verdier,guillotclaude@example.org,1990-01-25,0713611498,"51, boulevard de Boucher",93126,Julien,France,chef de projet multimédia expert en analyse de données avec 2 ans d'expérience,Dumont Hamel SARL,76307,Marié(e),4,BTS/DUT,2021-02-18,2024-08-02 02:11:37,false,Téléphone,Lecture
Laurent,Henry,alvesjeannine@example.net,1984-10-28,0793746270,"9, avenue Camus",19181,Valentin,France,économiste de la construction technicien en sécurité informatique avec 20 ans d'expérience,Lesage,99478,Veuf(ve),4,Doctorat,2024-12-22,2024-06-27 08:08:53,true,Email,"Sport, Art, Lecture"
Andrée,Raynaud,clemence28@example.net,1964-12-01,0748170871,"387, rue Brunet",09331,Sainte DominiqueBourg,France,secrétaire administratif conseiller en marketing digital avec 17 ans d'expérience,Normand S.A.,31546,Divorcé(e),3,BTS/DUT,2021-08-27,2024-08-17 01:48:33,true,Courrier,"Lecture, Art, Musique, Technologie"
Stéphane,Lenoir,dufourthomas@example.com,1963-03-10,0629945011,"59, rue Josette Blin",32101,Roy-sur-Leroy,France,grutier expert en intelligence artificielle avec 4 ans d'expérience,Royer S.A.S.,52059,Divorcé(e),0,Baccalauréat,2025-03-25,2024-11-03 11:06:18,false,Courrier,"Cuisine, Lecture, Jeux vidéo"
Jean,Hervé,buissonhugues@example.com,1999-10-22,0612523489,"2, rue Vincent Gay",80934,Delattre,France,ingénieur hydroécologue expert en sécurité informatique avec 16 ans d'expérience,Olivier,75083,Divorcé(e),1,Baccalauréat,2021-07-21,2024-12-17 03:50:15,false,Courrier,"Mode, Cinéma, Sport"
Théodore,Dupré,peronbenjamin@example.net,1951-02-10,0793627283,"6, chemin Julie Da Costa",48700,Saint Nath,France,géophysicien spécialisé en sécurité informatique avec 19 ans d'expérience,Imbert SA,30539,Célibataire,4,BTS/DUT,2024-01-12,2024-09-20 09:37:01,true,Courrier,"Voyage, Jeux vidéo, Sport"
Claude,Da Costa,rbodin@example.org,1994-01-03,0668297037,"9, rue Susanne Pichon",81612,Sainte Noël,France,horticulteur expert en marketing digital avec 18 ans d'expérience,Perrot,55798,Marié(e),4,Doctorat,2020-10-18,2024-08-04 09:17:11,false,Téléphone,"Technologie, Jeux vidéo, Cinéma"
Christophe,Lemaire,colettebrun@example.org,1961-05-16,0728110397,"31, rue Moulin",34405,Sainte Adélaïdedan,France,bactériologiste consultant en intelligence artificielle avec 7 ans d'expérience,Guyot S.A.,107017,Célibataire,4,Autre,2020-09-01,2025-03-18 00:30:57,false,SMS,"Art, Sport"
Élisabeth,Colin,dmorvan@example.com,1958-03-03,0787654362,"11, boulevard de Le Goff",63568,Pereira,France,conseiller en environnement responsable en qualité avec 13 ans d'expérience,Schneider S.A.S.,87522,Pacsé(e),4,BTS/DUT,2022-05-26,2024-05-04 17:48:58,true,Courrier,Cinéma
Stéphane,Tanguy,marcelle80@example.com,1967-11-05,0724531760,"54, avenue Lejeune",64874,Dupuis,France,vitrailliste analyste en analyse de données avec 8 ans d'expérience,Mallet Lemonnier SARL,34566,Célibataire,1,Baccalauréat,2024-03-12,2024-07-21 04:48:42,true,Téléphone,Sport
Josette,Potier,paulinejacob@example.org,1954-10-18,0757592273,"99, rue de Lemaire",33463,Sainte Édouard,France,hydrogéologue spécialisé en finance internationale avec 18 ans d'expérience,Costa,93452,Divorcé(e),1,Master,2024-07-17,2025-03-24 18:41:04,false,Téléphone,"Art, Cuisine, Technologie, Musique"
Claire,Moreau,nathaliewagner@example.org,1991-10-09,0686304451,"7, rue Garnier",78531,Dupré-sur-Bailly,France,chargé de veille législative et réglementaire conseiller en qualité avec 3 ans d'expérience,Becker,38463,Veuf(ve),3,Licence,2024-07-09,2025-02-07 16:38:48,false,Email,"Cinéma, Technologie"
Alix,Fouquet,kcamus@example.net,1954-05-05,0639016469,"36, rue de Samson",57397,Saint Aurélie,France,ingénieur de la police technique et scientifique ingénieur en développement web avec 11 ans d'expérience,Gautier,62295,Divorcé(e),3,Baccalauréat,2024-08-13,2024-11-16 04:57:21,false,Courrier,"Mode, Lecture, Technologie"
Célina,Renard,christine49@example.com,1997-04-12,0658880560,rue Marthe Lemaître,31247,Paris,France,brancardier consultant en qualité avec 10 ans d'expérience,Étienne SA,92843,Célibataire,2,Baccalauréat,2023-07-27,2024-09-01 07:21:00,true,Email,"Cuisine, Jeux vidéo, Voyage"
Rémy,Guillou,maurycorinne@example.net,1993-11-14,0625786897,"615, chemin André Bourgeois",80881,Barbier-sur-Mer,France,rudologue responsable en analyse de données avec 15 ans d'expérience,Faivre Diaz S.A.R.L.,101941,Veuf(ve),4,Doctorat,2025-03-21,2024-08-01 21:16:11,false,SMS,"Technologie, Voyage, Art, Lecture"
Capucine,Rocher,alice34@example.org,1985-02-15,0719452470,"32, rue de Rémy",28105,Sainte Rolanddan,France,directeur artistique expert en analyse de données avec 12 ans d'expérience,Toussaint,94739,Divorcé(e),2,Doctorat,2025-02-17,2024-08-13 03:41:55,false,Courrier,"Technologie, Sport, Mode"
Noël,Marchand,dcordier@example.org,2005-07-07,0644856766,"2, rue Michel Lagarde",34966,Guillou,France,chef de publicité technicien en développement web avec 4 ans d'expérience,Pichon SARL,61930,Divorcé(e),2,BTS/DUT,2021-08-29,2024-12-15 23:20:18,false,Email,"Lecture, Cuisine, Voyage, Mode"
Caroline,Guillaume,tbigot@example.org,1955-11-26,0733140796,"66, avenue Aurélie Thierry",83417,Raymond,France,agent de transit expert en sécurité informatique avec 12 ans d'expérience,Joly S.A.S.,38606,Divorcé(e),0,BTS/DUT,2021-05-18,2024-05-10 04:57:58,false,Téléphone,"Art, Technologie, Mode"
Xavier,Rodriguez,morenohortense@example.com,1971-08-29,0666945450,"33, chemin Aimée Clément",78554,MaillotVille,France,ingénieur intégration satellite technicien en développement web avec 9 ans d'expérience,Lefèvre S.A.,89709,Veuf(ve),4,Doctorat,2023-01-29,2024-05-26 21:53:27,true,SMS,"Mode, Musique, Lecture"
Pauline,Dupont,xchauveau@example.net,1967-10-09,0748726666,"86, rue de Bernard",03631,Gilbertdan,France,roboticien conseiller en logistique avec 20 ans d'expérience,Garnier Pelletier et Fils,109216,Célibataire,3,BTS/DUT,2021-04-12,2024-05-16 05:04:37,true,Téléphone,"Art, Lecture"
Claire,Laurent,remydelannoy@example.org,2000-10-17,0720653648,"9, chemin de Renault",49388,Barthelemy-sur-Bodin,France,technicien d'exploitation de l'eau responsable en ressources humaines avec 20 ans d'expérience,Duhamel Navarro S.A.R.L.,35618,Divorcé(e),1,Baccalauréat,2025-01-07,2024-06-21 23:58:19,true,Courrier,Cuisine
Brigitte,Dupuis,therese11@example.com,1972-03-09,0781384868,rue David Guillet,33958,Couturier,France,hydraulicien analyste en communication avec 19 ans d'expérience,Meunier S.A.,51488,Divorcé(e),1,BTS/DUT,2022-05-23,2024-08-27 15:47:33,false,Courrier,Art
Gilles,Deschamps,nbouvet@example.org,1957-11-15,0650308636,"82, avenue Lecoq",93592,CostaVille,France,architecte conseiller en gestion de projet avec 19 ans d'expérience,Perret,76153,Pacsé(e),0,BTS/DUT,2020-09-11,2024-11-29 06:32:28,true,Email,"Technologie, Art"
Laurence,Maréchal,julietteledoux@example.org,1986-01-13,061298913,"5, avenue Amélie Charles",11374,Blanchard-sur-Mer,France,opérateur de fabrication de produits alimentaires spécialisé en analyse de données avec 5 ans d'expérience,Maillet SA,75649,Pacsé(e),1,BTS/DUT,2021-12-13,2024-12-22 16:04:35,true,Email,"Musique, Jeux vidéo, Voyage, Cinéma"
Sébastien,Vidal,anais19@example.org,1971-04-11,0726322197,"86, boulevard Guibert",58521,Marion,France,ingénieur en production et expérimentations végétales spécialisé en finance internationale avec 5 ans d'expérience,Faure,77677,Pacsé(e),3,Autre,2025-03-03,2024-12-25 07:14:07,true,Email,"Sport, Musique"
Chantal,Fischer,francoiscouturier@example.org,1958-02-23,0687671685,"21, boulevard Simone Bonneau",57595,Marty,France,agent de constatation des douanes technicien en intelligence artificielle avec 15 ans d'expérience,Courtois S.A.R.L.,31752,Célibataire,0,Doctorat,2024-12-22,2024-09-29 04:23:44,false,Email,"Lecture, Jeux vidéo"
Suzanne,Gomes,bazinnath@example.org,1976-06-02,0761926847,"276, boulevard Richard Rolland",21815,Bourgeoisnec,France,chef de produit technique en informatique ingénieur en communication avec 13 ans d'expérience,Blondel Dubois et Fils,48456,Pacsé(e),1,Autre,2023-08-14,2024-05-15 03:00:14,false,Téléphone,"Art, Sport"
Diane,Robert,adelaideaubert@example.com,1979-10-05,0780045237,avenue Auguste Noël,43785,Ledoux,France,technicien télécoms et réseaux conseiller en ressources humaines avec 8 ans d'expérience,Berger S.A.S.,63766,Divorcé(e),3,Doctorat,2020-06-05,2024-07-18 18:03:23,true,Email,"Cinéma, Jeux vidéo"
Dominique,Schneider,urossi@example.org,2000-01-26,0643215725,chemin Rodriguez,01717,Guyon,France,ingénieur en imagerie médicale analyste en gestion de projet avec 3 ans d'expérience,Marques,114338,Pacsé(e),2,Baccalauréat,2023-11-02,2024-06-15 11:03:20,true,Courrier,Voyage
Océane,Roux,chantal48@example.org,1956-10-14,0617710951,avenue Regnier,97184,Goncalves,France,ingénieur hydroécologue consultant en finance internationale avec 2 ans d'expérience,Aubert,62459,Célibataire,3,Doctorat,2024-01-10,2025-03-31 20:17:55,true,Email,"Sport, Musique, Voyage, Lecture"
Roger,Gonzalez,sbourgeois@example.com,2001-10-06,0773918783,boulevard De Sousa,38104,LeblancBourg,France,chef monteur monteuse conseiller en communication avec 9 ans d'expérience,Lefèvre Michaud et Fils,93314,Veuf(ve),2,Master,2024-11-11,2024-06-01 06:42:31,true,Téléphone,Technologie
Michelle,Rivière,therese33@example.org,1969-07-19,0719710613,"82, boulevard Humbert",45696,Saint Valérie,France,décorateur consultant en marketing digital avec 2 ans d'expérience,Maury Dumont SA,43424,Marié(e),4,BTS/DUT,2020-08-10,2024-11-28 14:15:42,false,Email,"Jeux vidéo, Cinéma, Technologie"
Maggie,Laine,dleclercq@example.com,1952-07-19,0730375998,"82, chemin Cécile Rousset",21675,Valletnec,France,chargé de recherche et développement déchets responsable en intelligence artificielle avec 3 ans d'expérience,Jacques SARL,103486,Célibataire,3,Autre,2023-02-18,2024-11-27 00:19:04,true,Email,"Jeux vidéo, Musique"
Michèle,Daniel,inesriou@example.org,1950-02-22,0795860179,rue de Menard,41527,Lombard,France,chargé de valorisation de la recherche expert en analyse de données avec 13 ans d'expérience,Costa Lambert SARL,68942,Marié(e),4,Master,2021-05-12,2024-09-24 13:54:08,false,Email,"Voyage, Cinéma, Jeux vidéo, Sport"
Jean,Menard,edithleclerc@example.com,1987-11-20,0699375931,"5, rue Hugues Weiss",85101,Rocher-sur-Lecoq,France,conducteur de ligne de production alimentaire expert en gestion de projet avec 12 ans d'expérience,Jean S.A.R.L.,32186,Pacsé(e),0,Licence,2022-11-15,2024-11-03 05:45:45,true,SMS,"Cuisine, Technologie, Mode, Cinéma"
Éric,Normand,lucasanais@example.net,1986-01-08,0650371021,"12, avenue de Lelièvre",23549,Martin-la-Forêt,France,attaché de presse ingénieur en ressources humaines avec 9 ans d'expérience,Masson Martinez S.A.,31684,Pacsé(e),0,Master,2024-11-03,2024-12-08 10:00:29,true,Email,"Musique, Voyage"
