Christine,Philippe,uregnier@example.net,1983-12-23,0723133586,"955, avenue de Couturier",81338,Carre,France,gardien de police municipale analyste en sécurité informatique avec 3 ans d'expérience,Navarro Hardy S.A.R.L.,57611,Célibataire,1,Master,2023-10-30,2024-10-08 03:17:10,false,Courrier,Mode
Éléonore,Pottier,gilbert97@example.com,1982-09-17,0746745131,"81, chemin de Fernandez",82452,Benarddan,France,machiniste-constructeur ou plateau analyste en développement web avec 19 ans d'expérience,Boutin,35373,Pacsé(e),2,Doctorat,2025-04-05,2025-03-22 21:13:00,true,Téléphone,"Jeux vidéo, Musique"
Martin,Fischer,lmoreau@example.com,2003-09-13,0789874147,"22, rue François Jacques",28464,Guichard,France,agent arboricole conseiller en marketing digital avec 10 ans d'expérience,Laurent Pons SA,47352,Divorcé(e),2,Baccalauréat,2021-07-29,2025-04-25 10:02:23,false,SMS,Technologie
Victoire,Menard,marygabrielle@example.com,1953-06-20,0766906709,"21, chemin Benjamin Bertrand",21285,Alves-la-Forêt,France,animateur 2D et 3D spécialisé en sécurité informatique avec 19 ans d'expérience,Bazin,79780,Célibataire,1,Doctorat,2020-11-01,2025-03-31 11:06:11,false,Courrier,"Voyage, Sport"
Hugues,Petit,denis37@example.com,1951-02-04,0659287242,boulevard de Guichard,95116,Rocher-sur-Guillon,France,designer d'interaction spécialisé en cloud computing avec 10 ans d'expérience,Robin,37678,Veuf(ve),0,Doctorat,2022-05-29,2025-01-10 05:50:29,false,Email,"Technologie, Lecture, Voyage, Sport"
Aurore,Germain,baudrymichele@example.org,1969-01-19,0615462330,"82, boulevard de Léger",76660,Sainte Lucasboeuf,France,hydrogéologue conseiller en cloud computing avec 4 ans d'expérience,Moulin,31979,Marié(e),3,Baccalauréat,2021-01-04,2024-08-19 13:05:45,false,Email,"Voyage, Mode, Cuisine"
Renée,Auger,kmonnier@example.net,2003-03-07,0643976869,chemin Claire Garnier,97358,Buisson-sur-Sanchez,France,administrateur territorial responsable en développement web avec 4 ans d'expérience,Delmas Klein S.A.,108864,Pacsé(e),3,Doctorat,2023-04-06,2024-12-14 20:58:18,true,SMS,"Lecture, Voyage, Cuisine, Art"
Margaud,Bègue,payetmartine@example.net,1958-09-23,0657334786,rue Margaud Bousquet,26559,Saint Josette-les-Bains,France,géomaticien technicien en communication avec 5 ans d'expérience,Berger S.A.S.,113832,Pacsé(e),4,Baccalauréat,2025-01-06,2025-01-06 00:18:28,true,Courrier,"Musique, Lecture, Jeux vidéo"
Stéphanie,Rocher,simone39@example.com,1969-09-10,0731493293,"50, rue Jean",97186,Sainte Hélène-sur-Mer,France,ingénieur méthodes mécaniques spécialisé en ressources humaines avec 16 ans d'expérience,Noël Weber et Fils,34303,Marié(e),3,Licence,2022-02-02,2024-09-26 17:55:23,false,SMS,"Cuisine, Voyage, Sport"
Bernadette,Lemaire,rousseauanastasie@example.com,1987-02-03,0690871234,"93, avenue Roux",94540,Dos Santosboeuf,France,juriste en propriété intellectuelle spécialisé en analyse de données avec 17 ans d'expérience,Simon,115382,Marié(e),0,Licence,2021-03-18,2024-07-08 14:02:21,true,SMS,Sport
Olivie,Benard,cgros@example.org,1984-01-27,0650685610,"98, rue Guichard",30701,Chauveaunec,France,ingénieur technico-commercial technico-commerciale en chimie conseiller en analyse de données avec 5 ans d'expérience,Perret,37115,Marié(e),0,Master,2022-06-27,2024-10-20 02:09:18,true,Email,Cuisine
Frédéric,Hoareau,tessiervirginie@example.com,2000-06-25,0670566905,"515, rue de Moreau",23529,Vallet,France,animateur d'activités physiques et sportives pour tous technicien en ressources humaines avec 13 ans d'expérience,Chrétien SA,49543,Pacsé(e),2,Baccalauréat,2021-02-27,2025-02-16 16:02:05,false,Téléphone,"Musique, Art, Sport"
Joseph,Fernandez,rbarbe@example.net,1991-01-30,0620957924,"81, boulevard de Fouquet",67730,PottierBourg,France,ingénieur structures analyste en gestion de projet avec 11 ans d'expérience,Boulanger,118396,Divorcé(e),0,Autre,2025-02-20,2024-09-02 04:17:14,true,Courrier,"Voyage, Technologie"
Théodore,Gilles,thibautgonzalez@example.net,2000-04-07,0629364502,"4, rue Brunet",78754,Fontaine,France,ingénieur calcul expert en qualité avec 5 ans d'expérience,Blanc Launay SA,39173,Pacsé(e),4,Doctorat,2024-08-26,2024-07-16 20:59:15,false,Téléphone,"Art, Musique"
Sophie,Leblanc,roland77@example.com,2003-04-06,071661706,"7, rue de Launay",84486,Vallet,France,directeur artistique responsable en ressources humaines avec 19 ans d'expérience,Joubert et Fils,78952,Célibataire,4,Baccalauréat,2021-04-24,2024-11-28 02:32:54,false,SMS,"Sport, Cinéma"
Frédéric,Dumont,acolas@example.com,1975-09-23,0647185343,"22, boulevard Jourdan",51844,Marty-les-Bains,France,ingénieur d'affaires en génie électrique conseiller en marketing digital avec 8 ans d'expérience,Perez,96224,Pacsé(e),0,Autre,2021-12-13,2024-09-25 17:59:36,true,Courrier,Sport
Odette,Bazin,dle-gall@example.com,1987-07-22,0645155804,chemin Marc Rocher,12385,Gimenez,France,responsable de laboratoire de recherche technicien en analyse de données avec 20 ans d'expérience,Besnard,109933,Célibataire,2,BTS/DUT,2022-09-02,2024-10-05 18:45:21,false,Courrier,"Jeux vidéo, Mode, Lecture"
Benjamin,Fernandez,fournierchristiane@example.org,1974-01-16,0739955913,"91, boulevard Guichard",34391,Saint Suzanne,France,accompagnateur de tourisme équestre consultant en développement web avec 3 ans d'expérience,Dubois,37970,Pacsé(e),3,Licence,2022-12-28,2024-12-26 04:44:02,true,Email,"Technologie, Jeux vidéo, Cuisine"
Thierry,Adam,sophie61@example.net,1991-10-30,0777766477,"45, avenue de Petit",56372,Toussaint,France,consultant en conduite de changement analyste en ressources humaines avec 15 ans d'expérience,Fontaine,112625,Veuf(ve),4,Licence,2022-11-03,2024-08-30 12:06:26,false,Email,"Voyage, Cuisine"
Astrid,Roger,fphilippe@example.com,1976-07-31,0795103584,"17, chemin de Le Gall",84273,GrondinVille,France,attaché de presse analyste en ressources humaines avec 11 ans d'expérience,Techer,74119,Divorcé(e),4,Master,2022-07-15,2024-08-01 00:07:12,false,Téléphone,"Technologie, Musique, Cuisine"
Alexandre,Blanchard,gboutin@example.com,1986-04-09,0731429885,"3, chemin de Roussel",47395,Regnier,France,concepteur multimédia responsable en gestion de projet avec 11 ans d'expérience,Gay,41741,Célibataire,1,Doctorat,2022-10-21,2025-02-01 10:19:23,true,SMS,Technologie
Gabriel,Torres,lmarchand@example.net,1991-04-03,0745185756,"50, avenue Perrier",06557,SeguinVille,France,consultant SaaS responsable en sécurité informatique avec 20 ans d'expérience,Carre S.A.R.L.,114054,Divorcé(e),2,Autre,2021-04-01,2024-11-17 17:18:34,false,Téléphone,"Cinéma, Jeux vidéo, Sport"
Gérard,Vidal,couturierlouis@example.com,1984-02-20,0727161101,"3, chemin Adrienne Hoareau",77848,Seguin-sur-Leleu,France,généalogiste responsable en analyse de données avec 13 ans d'expérience,Pereira SARL,84194,Pacsé(e),3,BTS/DUT,2024-07-24,2024-09-11 17:54:19,false,SMS,"Cinéma, Musique"
Amélie,Charpentier,agneslopes@example.com,1957-08-06,0622147840,"304, chemin de Collin",86986,Vasseur-sur-Richard,France,technicien automobile analyste en qualité avec 10 ans d'expérience,Labbé Vincent SARL,63691,Veuf(ve),1,Baccalauréat,2022-09-24,2025-02-08 11:50:30,false,Email,"Art, Jeux vidéo"
Roland,Petit,paulettelecoq@example.org,1956-01-23,0666494472,chemin Coste,95695,Martins,France,chef de projet communication digitale analyste en intelligence artificielle avec 17 ans d'expérience,Vallet,78449,Célibataire,3,Autre,2021-07-09,2025-02-07 03:55:22,false,Téléphone,"Art, Sport, Technologie"
Jeannine,Hamon,stephaneseguin@example.com,1984-03-15,0771481226,"3, avenue Aimé Toussaint",35127,Légernec,France,conducteur de machines agricoles expert en logistique avec 13 ans d'expérience,Marie,35746,Célibataire,2,Autre,2024-12-01,2024-10-31 02:12:25,true,SMS,"Art, Cuisine, Musique"
Honoré,Lamy,madeleinenormand@example.org,1983-02-19,074151928,"791, boulevard Geneviève Blanc",97436,Grenier-sur-Mer,France,ingénieur calcul responsable en sécurité informatique avec 15 ans d'expérience,Delorme Nguyen S.A.S.,40728,Marié(e),3,Licence,2023-08-31,2024-12-27 19:20:51,true,Email,"Sport, Mode, Cinéma, Cuisine"
Hugues,Bazin,susan18@example.net,1990-03-02,0789044893,rue de Voisin,32418,Toussaint,France,sous-officier de l'armée de terre responsable en logistique avec 9 ans d'expérience,Seguin Laurent S.A.R.L.,27644,Divorcé(e),2,Master,2020-08-05,2025-03-19 11:16:27,false,Email,"Musique, Art, Voyage, Lecture"
Gilbert,Gillet,marcelle63@example.org,1982-09-16,06645098,"62, boulevard Patricia Moreau",25730,Saint Benoîtnec,France,conducteur de bus ou d'autocar responsable en analyse de données avec 15 ans d'expérience,Didier et Fils,82589,Marié(e),0,Master,2022-05-14,2025-03-05 12:12:08,true,Courrier,"Technologie, Mode, Musique"
Henriette,Grenier,xcoulon@example.org,1959-12-23,0658820834,"70, rue Valentin",76155,Torres,France,plâtrier ingénieur en finance internationale avec 7 ans d'expérience,Gros,40740,Pacsé(e),0,Baccalauréat,2023-03-20,2025-01-29 07:43:15,false,Téléphone,Technologie
Richard,Lacroix,guyonclaude@example.net,1958-07-03,0746352528,boulevard Clément,34307,Dupuis,France,maquilleur artistique technicien en finance internationale avec 10 ans d'expérience,Reynaud S.A.S.,33810,Divorcé(e),4,Baccalauréat,2022-10-31,2025-02-17 06:20:25,false,Courrier,"Technologie, Mode, Jeux vidéo, Lecture"
Adrienne,Boulay,vjacquet@example.com,1955-04-28,0732858430,"90, chemin Cordier",54907,Noël,France,menuisier conseiller en analyse de données avec 3 ans d'expérience,Pons S.A.S.,79985,Pacsé(e),4,Autre,2023-09-07,2024-12-04 09:35:52,true,Courrier,"Art, Lecture"
Aimée,Gimenez,marguerite18@example.com,1998-10-12,0639844140,"29, boulevard Honoré Dijoux",97270,Morvan,France,éducateur canin canine technicien en ressources humaines avec 17 ans d'expérience,Blondel,118025,Pacsé(e),3,Autre,2024-01-23,2024-08-18 04:05:42,true,Téléphone,"Voyage, Art"
Timothée,Marion,ubruneau@example.com,1969-11-02,0750574796,"16, boulevard Loiseau",49803,Peron-sur-Rodrigues,France,employé d'élevage responsable en qualité avec 15 ans d'expérience,Maury,57181,Célibataire,4,Licence,2023-09-23,2024-12-28 11:12:10,false,Courrier,"Musique, Technologie, Mode, Art"
Danielle,Mallet,dominique80@example.net,1955-06-16,0682612758,"1, rue Brunet",73386,Saint Alexandrieboeuf,France,chef de chantier conseiller en marketing digital avec 7 ans d'expérience,Rousset,54642,Pacsé(e),4,Baccalauréat,2020-09-18,2024-10-03 04:22:22,true,Téléphone,"Voyage, Cuisine, Technologie"
Édith,Lambert,victorperrot@example.com,1970-12-30,0675122632,"790, rue Daniel Lambert",93347,Sainte PierreVille,France,responsable de réseau d'assainissement consultant en logistique avec 13 ans d'expérience,Boulanger,94360,Pacsé(e),2,Doctorat,2022-06-21,2024-07-03 07:52:40,true,Email,"Voyage, Cinéma, Cuisine, Musique"
Jérôme,Techer,ydelannoy@example.com,2002-05-22,0619334472,avenue de Chartier,97225,Mahe,France,programmiste conseiller en gestion de projet avec 20 ans d'expérience,Albert,57557,Divorcé(e),2,Autre,2023-11-21,2024-06-22 02:55:57,false,Téléphone,"Mode, Cuisine, Musique, Technologie"
Raymond,Salmon,honore79@example.com,1959-08-09,0644573278,rue Lacombe,39202,Leclerc,France,soudeur spécialisé en logistique avec 12 ans d'expérience,Bourdon Masse et Fils,31352,Veuf(ve),0,Licence,2025-04-02,2024-12-13 01:36:50,true,Email,Jeux vidéo
Constance,Dumont,luce35@example.org,2000-05-30,0784289349,"197, rue Camus",77221,Saint Mathilde,France,agenceur de cuisines et salles de bains responsable en cloud computing avec 20 ans d'expérience,Colas S.A.S.,85654,Marié(e),1,Doctorat,2025-01-26,2025-01-21 14:40:06,false,Téléphone,Musique
Alexandrie,Petitjean,schmittmaggie@example.org,1982-06-09,0687701143,"8, rue de Navarro",35852,Nguyen,France,modéliste ingénieur en analyse de données avec 14 ans d'expérience,Lefort,37357,Célibataire,0,Licence,2020-10-13,2025-01-07 20:00:18,true,Téléphone,Jeux vidéo
Thierry,Charrier,hernandezhugues@example.com,1977-03-28,0656096047,"9, boulevard Antoine",97199,Dumasnec,France,teinturier blanchisseur technicien en qualité avec 18 ans d'expérience,Deschamps,32733,Veuf(ve),3,BTS/DUT,2025-03-16,2025-02-01 00:08:13,true,SMS,"Musique, Lecture, Jeux vidéo, Cuisine"
Arthur,Leroy,pereiraraymond@example.net,1969-12-19,06642262,"65, boulevard de Durand",08996,Gosselin,France,électromécanicien technicien en communication avec 15 ans d'expérience,Rossi,88918,Veuf(ve),3,Doctorat,2021-11-23,2025-02-17 09:50:04,true,Courrier,"Art, Musique"
Isabelle,Leroy,marysebegue@example.org,1967-03-29,0668078170,"748, avenue Poirier",95133,Jacquot,France,géographe consultant en sécurité informatique avec 16 ans d'expérience,Neveu,93176,Marié(e),0,BTS/DUT,2022-04-21,2024-09-20 05:45:50,true,SMS,"Sport, Cuisine"
Constance,Rey,lucefaure@example.org,1986-01-30,0720744565,"281, rue Rémy",67274,Lévy,France,ingénieur technico-commercial technico-commerciale conseiller en marketing digital avec 3 ans d'expérience,Maréchal Ollivier S.A.R.L.,82671,Veuf(ve),2,Doctorat,2025-03-11,2024-05-20 21:27:59,true,Courrier,"Technologie, Lecture"
Louise,Vallet,stephanepayet@example.com,2004-04-27,06582807,"57, avenue de Fontaine",52351,Durand,France,responsable qualité en agroalimentaire analyste en qualité avec 3 ans d'expérience,Germain,34473,Divorcé(e),0,Licence,2024-12-17,2025-04-07 06:19:23,true,Courrier,"Sport, Musique, Lecture, Voyage"
Constance,Gonzalez,ylabbe@example.net,1961-06-05,077360027,"90, rue Timothée Torres",93786,Renard-les-Bains,France,orthoptiste consultant en qualité avec 3 ans d'expérience,Maurice Cousin S.A.S.,93864,Veuf(ve),1,BTS/DUT,2021-12-06,2024-07-09 07:27:52,true,Email,Jeux vidéo
Alix,Dos Santos,tleger@example.net,2001-04-22,06667519,"24, rue de Fabre",13286,Sainte Margaud,France,juriste en droit social technicien en finance internationale avec 13 ans d'expérience,Coulon,116941,Veuf(ve),4,Master,2021-05-21,2025-03-31 17:58:32,false,Téléphone,"Mode, Technologie"
Nath,Grégoire,barthelemymichele@example.org,1981-02-03,0681048329,"97, rue Bouchet",66824,Sainte Jacques,France,employé de restaurant ingénieur en sécurité informatique avec 2 ans d'expérience,Barbe Leclercq SA,31680,Marié(e),2,Doctorat,2021-08-24,2025-04-18 08:17:45,false,Email,"Cinéma, Technologie, Mode"
Marguerite,Colin,georges83@example.com,1958-12-30,0772139687,rue Hamel,57422,Foucher-les-Bains,France,sportif de haut niveau spécialisé en sécurité informatique avec 9 ans d'expérience,Merle,103123,Célibataire,1,Doctorat,2022-11-14,2024-11-21 23:26:53,true,Email,"Cuisine, Jeux vidéo"
Théophile,Ferreira,fgermain@example.com,1990-02-05,0671247516,"3, rue Mathilde Gros",22897,Caron,France,technicien télécoms et réseaux spécialisé en ressources humaines avec 8 ans d'expérience,Charrier S.A.S.,91240,Célibataire,4,Autre,2023-10-13,2025-02-01 17:58:32,false,SMS,"Voyage, Sport, Technologie, Mode"
Matthieu,Thibault,allardluce@example.net,1972-01-16,077677526,"221, rue Maurice",68663,Sainte Suzanne,France,ingénieur électronicien électronicienne des systèmes de la sécurité aérienne (IESSA) spécialisé en ressources humaines avec 20 ans d'expérience,Mahe,47387,Divorcé(e),4,Doctorat,2023-10-21,2024-08-25 07:46:17,false,SMS,"Voyage, Mode, Cuisine"
Marcel,Daniel,cdiallo@example.org,1980-09-15,0676007908,chemin Margaret Chauvin,62290,Delaunay,France,web-ergonome conseiller en développement web avec 11 ans d'expérience,Dupuis,35732,Marié(e),3,Master,2021-02-10,2025-01-26 06:11:13,true,Email,"Jeux vidéo, Art, Cuisine, Mode"
Michèle,Guillet,lperrier@example.org,1957-12-30,0632158792,"1, chemin Teixeira",01123,Guyon,France,magistrat spécialisé en communication avec 19 ans d'expérience,Leroy Turpin S.A.,81074,Célibataire,3,Baccalauréat,2023-02-16,2025-02-23 14:42:24,false,SMS,Sport
Odette,Bruneau,gomeslucy@example.org,1957-07-27,0665554660,"52, avenue de Duval",71376,Poirier-sur-Colas,France,conducteur d'engins forestiers de récolte en entreprises de travaux forestiers consultant en sécurité informatique avec 8 ans d'expérience,Aubert,40190,Veuf(ve),3,BTS/DUT,2021-07-02,2024-11-22 17:44:57,true,Email,"Cinéma, Technologie, Lecture, Musique"
Denise,Klein,pasquiervalentine@example.net,1953-07-29,0664118182,"10, avenue de Lefort",78492,Sainte Véronique,France,conseiller principal d'éducation principale d'éducation technicien en communication avec 11 ans d'expérience,Blanc SA,29113,Pacsé(e),4,Licence,2023-02-26,2024-12-07 21:08:02,false,Email,"Mode, Voyage, Technologie"
Augustin,Faure,remy34@example.org,1998-11-10,0797057054,"27, rue de Foucher",94446,Delorme,France,convoyeur de fonds ingénieur en intelligence artificielle avec 6 ans d'expérience,Tanguy,50926,Marié(e),0,Baccalauréat,2022-05-17,2024-06-27 13:14:22,false,Téléphone,"Technologie, Musique"
Juliette,De Oliveira,uturpin@example.com,1968-10-10,0710517632,"57, rue Frédéric Becker",28705,Marion-sur-Riou,France,ingénieur du BTP responsable en sécurité informatique avec 16 ans d'expérience,Carlier,113571,Veuf(ve),4,Autre,2023-04-17,2025-01-10 17:49:15,true,SMS,Cinéma
Odette,Michel,dhardy@example.net,1981-01-09,0781571097,"72, rue Lucas",06639,Marie,France,ingénieur logistique responsable en communication avec 7 ans d'expérience,Lemonnier,96263,Célibataire,4,Licence,2020-10-20,2025-03-17 03:56:09,true,Email,"Art, Voyage, Jeux vidéo"
Simone,Rocher,alexandriechauvet@example.com,1960-09-02,0725193780,"3, chemin Lucy Roche",29589,Ferrand-les-Bains,France,géothermicien responsable en logistique avec 14 ans d'expérience,Meyer Brun SA,47540,Célibataire,0,Master,2024-07-27,2024-12-05 16:03:19,true,SMS,Sport
Louise,Bailly,brunlouis@example.net,1952-12-28,072828444,"77, chemin de Lefèvre",57162,Saint Margauxboeuf,France,chargé de projet événementiel technicien en logistique avec 2 ans d'expérience,Valentin,113747,Divorcé(e),2,Doctorat,2024-05-25,2025-04-07 02:24:56,true,Email,"Cinéma, Voyage"
François,Deschamps,yle-gall@example.com,2004-10-10,0739188791,"17, boulevard Georges Wagner",38567,Lebon,France,comptable expert en finance internationale avec 6 ans d'expérience,Lagarde S.A.,64206,Célibataire,2,Master,2022-10-16,2024-09-27 10:19:59,false,SMS,"Musique, Mode, Lecture"
Victor,Hoareau,mathildetoussaint@example.com,1956-08-21,0733471424,"13, boulevard Nicolas",59384,Berthelot-sur-Maréchal,France,architecte produit industriel consultant en communication avec 19 ans d'expérience,Thierry Roche S.A.,41411,Divorcé(e),4,Doctorat,2025-02-09,2025-02-06 07:41:02,false,Téléphone,"Jeux vidéo, Technologie, Art"
Pauline,Girard,valentine77@example.net,1977-08-28,0745710465,"93, boulevard de Traore",50738,Reynaud,France,concepteur multimédia spécialisé en sécurité informatique avec 3 ans d'expérience,Lemaire,110653,Pacsé(e),2,Licence,2022-03-26,2024-08-09 04:49:49,false,SMS,"Art, Musique"
Agathe,Devaux,maurymichele@example.net,1982-02-12,0718587191,"90, rue Maggie Bertrand",41878,Chrétiendan,France,ingénieur en fonderie spécialisé en qualité avec 6 ans d'expérience,Baron,37604,Célibataire,0,Licence,2025-03-22,2024-09-30 20:55:48,true,Courrier,"Sport, Technologie"
René,Dupont,kpruvost@example.net,1988-08-24,0735316356,rue Josette Diallo,74297,GrosVille,France,professeur-documentaliste ingénieur en logistique avec 12 ans d'expérience,Bouvet S.A.R.L.,45566,Marié(e),1,BTS/DUT,2023-04-29,2024-11-08 02:46:57,false,Courrier,"Sport, Voyage, Technologie, Art"
Éric,Barre,benoitwagner@example.org,1991-04-30,0684149107,"70, rue Gauthier",14905,Marion,France,musicien analyste en analyse de données avec 10 ans d'expérience,Bourgeois Hardy SARL,61405,Pacsé(e),0,BTS/DUT,2024-04-09,2024-06-19 17:15:28,true,SMS,Sport
Odette,Pires,wmasse@example.org,2004-12-05,0674161231,"73, boulevard Aurore Rousset",06842,GillesBourg,France,canalisateur consultant en cloud computing avec 15 ans d'expérience,Ferreira,93776,Marié(e),2,Licence,2024-06-04,2024-06-28 09:00:51,false,SMS,Technologie
Henri,Lacroix,isabelleleroy@example.com,1987-05-08,0679155142,"45, rue Sabine Launay",83553,Sainte Lauredan,France,technicien de maintenance en génie climatique technicien en communication avec 13 ans d'expérience,Bernier,74577,Marié(e),2,Doctorat,2022-10-21,2024-12-26 13:14:32,true,Email,"Lecture, Technologie, Art, Mode"
Valentine,Mahe,dlopes@example.net,1978-06-15,0721431459,"8, boulevard Millet",15735,Launay,France,directeur d'office de tourisme conseiller en marketing digital avec 17 ans d'expérience,Laroche Royer S.A.,81443,Célibataire,2,Master,2022-10-26,2024-12-06 14:48:06,false,Courrier,"Mode, Lecture"
Hugues,Pichon,pruvostsophie@example.org,1980-07-19,0732103746,"39, rue Benoit",97127,Legros-sur-Hoareau,France,décolleteur consultant en marketing digital avec 5 ans d'expérience,Legrand S.A.R.L.,36460,Pacsé(e),2,Doctorat,2020-08-28,2024-08-28 06:46:29,true,Courrier,"Art, Cuisine, Mode, Sport"
Auguste,Roy,odelattre@example.org,1975-09-16,0751699615,"11, chemin de Gay",14358,Poulain,France,danseur conseiller en marketing digital avec 19 ans d'expérience,Baron,84052,Divorcé(e),1,Autre,2022-05-19,2025-04-26 18:13:24,true,SMS,"Mode, Lecture"
Élise,Diallo,alain36@example.net,1991-12-06,0790628793,"344, rue Perrot",01144,Wagner,France,ingénieur d'affaires en génie électrique spécialisé en développement web avec 11 ans d'expérience,Roche S.A.S.,91289,Célibataire,0,Doctorat,2022-07-27,2025-01-09 22:38:52,true,Courrier,Jeux vidéo
Auguste,Loiseau,nathalie89@example.org,1992-11-19,0624305313,"142, chemin Nguyen",18856,Blancboeuf,France,convoyeur de fonds technicien en logistique avec 3 ans d'expérience,Rémy Barre S.A.,42313,Veuf(ve),4,Licence,2021-02-12,2024-05-29 03:52:00,true,Email,"Voyage, Cinéma, Technologie, Sport"
Gabriel,Marchand,dchevalier@example.net,1996-12-12,0714994978,"3, boulevard de Diaz",36298,Sainte Raymond,France,patron pêcheur analyste en sécurité informatique avec 19 ans d'expérience,Aubry,93050,Célibataire,1,Master,2021-06-23,2024-12-19 16:54:35,true,Téléphone,"Musique, Jeux vidéo, Mode, Art"
Georges,Chartier,camille26@example.net,1956-12-23,0757606999,"488, chemin Charlotte Allard",92195,Roger-sur-Bertin,France,secrétaire spécialisé en marketing digital avec 3 ans d'expérience,Hervé et Fils,92557,Veuf(ve),4,Baccalauréat,2022-09-17,2025-04-18 08:05:16,false,SMS,Musique
Olivier,Bousquet,charpentierremy@example.net,1971-02-04,0679831869,"4, rue de Briand",97472,Labbénec,France,sommelier expert en développement web avec 18 ans d'expérience,Bernier,44699,Veuf(ve),4,BTS/DUT,2021-02-15,2024-07-12 00:21:51,true,Email,"Cuisine, Art"
Margaret,Pereira,sebastienperon@example.com,1982-11-03,078065274,"336, avenue Loiseau",93882,Meyer-sur-Leclercq,France,fiscaliste responsable en ressources humaines avec 17 ans d'expérience,Gillet SA,27564,Pacsé(e),4,Autre,2020-10-23,2024-08-02 20:46:31,true,SMS,"Cinéma, Mode"
Jacqueline,Guichard,alix85@example.org,1991-04-04,0685623010,"8, rue Frédérique Lopez",65238,Moreno,France,aide-soignant analyste en sécurité informatique avec 14 ans d'expérience,Marchand,38830,Célibataire,3,Autre,2021-11-29,2025-01-05 13:36:11,true,Courrier,"Cuisine, Technologie, Sport"
Astrid,Gilbert,dleduc@example.org,1986-02-22,0792039723,"63, avenue de Berger",77309,Lemaire,France,ingénieur en imagerie médicale technicien en intelligence artificielle avec 16 ans d'expérience,Gilbert,60042,Marié(e),0,Licence,2022-10-18,2024-09-25 09:01:22,true,SMS,"Technologie, Sport"
Anouk,Brunel,jacquelinecharles@example.org,1963-04-28,0687032227,"75, avenue Techer",01218,Fernandeznec,France,inséminateur ingénieur en ressources humaines avec 3 ans d'expérience,Dupont Didier SA,103729,Divorcé(e),3,Autre,2022-04-24,2024-10-05 05:15:06,false,Courrier,Sport
Yves,Valentin,mauricebriand@example.org,1964-10-09,0687763450,"5, chemin de Bourdon",55760,Saint AdèleVille,France,chef de chantier en installations électriques analyste en qualité avec 12 ans d'expérience,Dubois,95076,Célibataire,0,Licence,2023-01-04,2024-09-23 22:30:47,true,Téléphone,"Art, Technologie"
William,Mahe,eleonoredaniel@example.org,1972-04-08,0747695653,"96, boulevard Bigot",73853,Monnier,France,officier marinier marinière responsable en qualité avec 3 ans d'expérience,Joubert,38200,Veuf(ve),0,Baccalauréat,2023-08-11,2024-09-05 07:29:12,false,Courrier,Sport
Maurice,Poulain,mathilde26@example.com,1972-05-31,0644343808,rue de Vallet,07140,Lelièvre,France,chef de chantier en installations électriques technicien en cloud computing avec 15 ans d'expérience,Moreau,62321,Célibataire,2,Autre,2023-09-21,2025-01-03 00:33:59,true,Courrier,"Art, Cinéma, Musique, Technologie"
Nicolas,Letellier,madeleine21@example.com,1991-08-07,0641993548,"241, avenue de Perrot",11923,Robin,France,conducteur opérateur opératrice de scierie technicien en logistique avec 18 ans d'expérience,Robert Verdier et Fils,69604,Célibataire,2,Licence,2021-01-05,2025-03-20 14:17:14,true,Téléphone,"Sport, Jeux vidéo, Art"
Margaret,Lamy,whernandez@example.com,1972-12-10,0691776932,"39, rue Fischer",73925,Carpentier,France,conseiller pénitentiaire d'insertion et de probation expert en analyse de données avec 12 ans d'expérience,Gonzalez,67909,Pacsé(e),4,Master,2022-12-09,2024-07-30 01:04:06,false,Téléphone,"Musique, Mode, Sport, Lecture"
Noémi,Diallo,mathildedelmas@example.net,2004-03-11,0738928617,"9, chemin Thomas Duval",30426,Charles-la-Forêt,France,consultant en validation consultant en gestion de projet avec 17 ans d'expérience,Mace,96684,Pacsé(e),2,Baccalauréat,2022-10-23,2025-02-15 16:19:14,true,SMS,"Art, Jeux vidéo"
